recipe_id,recipe_name,category,cuisine,dietary_restrictions,difficulty,prep_time_mins,cook_time_mins,total_time_mins,servings,calories,protein_g,carbs_g,fat_g,rating,num_reviews,ingredients,equipment_needed,author,date_added
RCP03733,Crispy Salad,Beverage,Mexican,Paleo,Hard,46,43,89,12,199,72.4,66.7,96.9,1.4,4294,"BROCCOLI, ZUCCHINI, CAULIFLOWER, LETTUCE, OATS, YOGURT, CINNAMON, CUMIN, BASIL, OREGANO","blender, slow cooker, grill, stovetop",Sarah Wilson,02/08/2025
RCP03734,Sweet Curry,Snack,American,Vegetarian,Easy,7,111,118,10,555,69.7,119.8,65.6,3.6,3097,"beef, cauliflower, butter, thyme, basil","stovetop, pressure cooker, blender",Mary Smith,28/10/2025
RCP03735,Sweet Soup,Breakfast,Italian,None,Medium,30,177,207,12,,16,25.8,81,2.5,2099,"chicken, lettuce, onions, potatoes, cinnamon","grill, microwave, pressure cooker",mary smith,10/06/2023
RCP03736,Herb Rice Bowl,Breakfast,Mexican,Gluten-Free,Easy,69,181,250,,299,69.2,70.8,38.9,3.9,658,"turkey, bell peppers, onions, lettuce, quinoa, milk, pepper, thyme, cumin, paprika","slow cooker, blender, stovetop, oven",Chef John,
RCP03737,Savory Rice Bowl,Dessert,Italian,None,Easy,,,,11,1168,-2.5,14.6,32.4,1.1,2605,"turkey, zucchini, lettuce, oregano, pepper","microwave, food processor",CHEF JOHN,03/10/2024
RCP03738,Creamy Bread,Dessert,Japanese,Vegan,Expert,62,226,288,9,392,75.1,1.3,95.2,5,3009,"spinach, butter, paprika, cumin, salt, cinnamon","mixer, slow cooker, oven, grill",Chef John,21/07/2023
RCP03739,Tacos,Lunch,American,None,Easy,924,1152,2076,7,834,3.6,92.9,31.2,3.2,159,"lamb, zucchini, garlic, cheese, basil, paprika, pepper","mixer, blender, oven, food processor",emily chen,06-18-24
RCP03740,Roast,Lunch,American,None,Medium,81,236,317,11,834,58.3,1.7,65.1,3.6,919,tofu; onions; pasta; cheese; cumin; paprika,"food processor, oven, mixer, slow cooker",Mary Smith,19/06/2024
RCP03741,Tangy Cake,Lunch,Mediterranean,None,Hard,35,11,46,4,1181,,135.4,17.9,2.2,493,"turkey, bell peppers, rice, pepper, salt, thyme","pressure cooker, microwave, slow cooker, blender",emily chen,04/03/2025
RCP03742,Crispy Tacos,Dessert,American,None,Medium,41,75,116,9,476,9.6,81.5,50.9,4.3,3009,"tofu, potatoes, carrots, zucchini, flour, cream, pepper, thyme, cinnamon","blender, microwave",emily chen,07/10/2023
RCP03743,Herb Roast,Salad,Italian,None,Medium,,,,2,787,44.7,45.9,,3.4,1813,,"mixer, stovetop",Chef John,05-26-25
RCP03744,Savory Cake,Dinner,Mexican,None,Hard,22,94,116,5,421,39.7,146.6,49.3,1.8,2258,"pork, spinach, zucchini, quinoa, paprika, basil, cinnamon, salt","grill, oven, stovetop",Sarah Wilson,28/10/2023
RCP03745,Spicy Smoothie,Breakfast,Chinese,Low-Carb,Expert,30,121,151,11,1008,46.7,36.6,61.6,2.4,4700,"eggs, zucchini, potatoes, onions, oats","grill, air fryer, pressure cooker, mixer",emily chen,23/10/2024
RCP03746,Crispy Cake,Snack,Italian,None,Easy,82,180,262,5,578,74.3,135.6,21.4,4.9,1478,"SPINACH, BELL PEPPERS, CINNAMON, CUMIN","food processor, oven, microwave",Emily Chen,10/12/2023
RCP03747,Sweet Roast,Snack,Chinese,None,Hard,92,160,252,8,552,71.9,14.4,29.2,,4423,"spinach, cinnamon, pepper, basil",air fryer,emily chen,21/04/2023
RCP03748,Sweet Grilled,Dinner,Italian,None,Expert,102,226,328,10,280,29.2,59,8.6,4.1,3729,"TURKEY, LETTUCE, POTATOES",grill,Bob Johnson,02/12/2024
RCP03749,Spicy Salad,Lunch,Spanish,Paleo,Easy,53,183,236,1,202,39.3,59.9,83.1,,4197,"lamb, onions, broccoli, mushrooms, potatoes, cream, paprika, cumin, cinnamon",,mary smith,09/06/2023
RCP03750,Savory Cookies,Dessert,Thai,None,Hard,18,145,163,5,855,57.8,135.9,14.8,1.8,3898,"onions, yogurt, cumin, salt","blender, mixer",,25/07/2023
RCP03751,Sweet Baked,Dinner,Vietnamese,None,Expert,54,133,187,,467,44.3,,69.1,2.4,926,zucchini; garlic; rice; yogurt; cumin; salt,"slow cooker, blender, stovetop, microwave",CHEF JOHN,24/04/2025
RCP03752,Crispy Bread,Appetizer,Korean,Dairy-Free,Easy,,,,4,126,27.4,32.6,14.8,3.3,2425,"mushrooms, garlic, cauliflower, carrots, pasta, cumin, cinnamon, salt, paprika","slow cooker, mixer, air fryer",mary smith,
RCP03753,Herb Soup,Dessert,Mediterranean,None,Medium,112,205,317,2,,46.6,139.7,-6,4.4,4267,"shrimp, cauliflower, potatoes, onions, paprika, cumin",mixer,mary smith,06/05/2024
RCP03754,Tangy Fried,Dessert,Mexican,None,Easy,42,171,213,7,483,8.9,134.3,10.2,,2074,"PORK, TOMATOES, SPINACH, LETTUCE, BREAD, CINNAMON, PAPRIKA, PEPPER, CUMIN","slow cooker, food processor",David Lee,05/10/2025
RCP03755,Crispy Steamed,Breakfast,Mediterranean,None,Expert,52,74,126,8,,69.4,47.8,85.4,5,994,"lamb, garlic, onions, pepper, oregano, basil","pressure cooker, air fryer, microwave, mixer",chef john,31/03/2023
RCP03756,Baked,Dinner,Thai,Vegetarian,Easy,,,,5,,0.8,97.8,51.3,,1224,"fish, potatoes, oregano, salt",grill,Chef John,
RCP03757,Salad,Snack,American,None,Hard,7,107,114,3,1066,23.9,92.7,28.4,3.9,4974,"carrots, lettuce, garlic, broccoli, cheese, cinnamon, salt, thyme, paprika","blender, mixer",mary smith,12/05/2024
RCP03758,Savory Noodles,Dinner,Vietnamese,None,Easy,44,103,147,12,138,-8.5,28.3,76.6,2.2,650,"garlic, salt, cinnamon, paprika","slow cooker, microwave",CHEF JOHN,
RCP03759,Tangy Cookies,Lunch,Japanese,Vegetarian,Hard,23,42,65,4,512,76,75.5,31.9,4.6,3335,"fish, broccoli, mushrooms, cauliflower, paprika, thyme, pepper, oregano","blender, grill",David Lee,24/04/2023
RCP03760,Spicy Grilled,Lunch,Indian,Vegan,Medium,34,120,154,4,958,65,107.8,44.1,-1.6,1549,"fish, bell peppers, milk, thyme, pepper, paprika, cinnamon","food processor, mixer, blender",Emily Chen,10/08/2024
RCP03761,Savory Casserole,Dessert,Japanese,Paleo,Expert,46,223,269,11,788,49.7,72.1,93.1,,1450,"eggs, bell peppers, tomatoes","mixer, microwave",mary smith,16/02/2025
RCP03762,Spicy Casserole,Appetizer,Mexican,Vegetarian,Easy,67,196,263,7,439,44.9,33.3,65.6,3.6,3585,"lamb, cauliflower, lettuce, broccoli, tomatoes, bread, cumin, pepper, paprika","food processor, oven",emily chen,28/06/2024
RCP03763,Curry,Beverage,Vietnamese,None,Medium,64,180,244,3,573,54.2,61.4,51.6,3.6,2322,lamb; onions; garlic; potatoes; spinach; noodles; milk; basil,"stovetop, blender",,29/05/2024
RCP03764,Sweet Cake,Appetizer,Korean,None,Medium,87,104,191,4,815,51.7,2.7,28.8,2.4,1875,"turkey, mushrooms, zucchini, potatoes, onions, milk, cinnamon, salt","slow cooker, food processor, air fryer, grill",Mary Smith,05/08/2025
RCP03765,Herb Sandwich,Dinner,Spanish,None,Medium,113,157,270,5,183,55.7,83.1,58.5,1.7,3422,broccoli; zucchini; spinach; oregano; cumin,"blender, oven, mixer",Bob Johnson,04/04/2023
RCP03766,Sweet Fried,Breakfast,Mexican,None,Expert,117,173,290,9,691,9,111.7,46.1,4.6,4649,"shrimp, broccoli, onions, potatoes, noodles, basil, paprika",mixer|oven|food processor|slow cooker,mary smith,22/09/2023
RCP03767,Tangy Bread,Salad,American,None,Medium,102,63,165,1,878,42.9,124.2,37.1,4.7,804,shrimp; onions; lettuce; broccoli; bell peppers; cinnamon; pepper,"grill, slow cooker, pressure cooker, air fryer",Sarah Wilson,28/11/2025
RCP03768,Spicy Pasta,Appetizer,French,Paleo,Expert,48,200,248,11,821,7.3,22,31.5,2.2,558,chicken; bell peppers; broccoli; carrots; cauliflower; bread; yogurt; salt; oregano,"slow cooker, pressure cooker, blender",Bob Johnson,21/03/2023
RCP03769,Spicy Cookies,Dinner,Vietnamese,None,Easy,95,228,323,5,627,70.5,4.9,76.5,1.4,3094,,"microwave, mixer",Emily Chen,25/05/2025
RCP03770,Crispy Steamed,Breakfast,Korean,None,Expert,49,177,226,1,1014,34.7,32.2,53.8,2.1,216,"turkey, potatoes, lettuce, thyme, salt, cinnamon, basil","pressure cooker, slow cooker, grill, air fryer",Bob Johnson,15/04/2023
RCP03771,Bread,Dinner,American,None,Medium,82,179,261,8,269,37.1,144.8,63.6,1.6,-5,"fish, zucchini, potatoes, spinach, quinoa, thyme, pepper","microwave, grill, mixer, blender",Mary Smith,14/09/2023
RCP03772,Rice Bowl,Dessert,Greek,None,Easy,-19,-57,-76,7,1024,74.7,7.4,0.5,3.2,2785,"spinach, carrots, yogurt, basil, thyme","grill, oven, microwave",Mary Smith,24/02/2023
RCP03773,Tangy Cookies,Beverage,Italian,None,Medium,113,42,155,1,,63.4,73.1,52.4,1.7,2201,"mushrooms, spinach, tomatoes, carrots","microwave, stovetop",Sarah Wilson,21/11/2025
RCP03774,Herb Pie,Dinner,Spanish,None,Easy,-10,-53,-63,5,8308,48.5,-7.5,13.8,,2005,"ONIONS, BROCCOLI, POTATOES, SPINACH, FLOUR, BASIL, CINNAMON, SALT, PEPPER",pressure cooker,Mary Smith,02/01/2026
RCP03775,Sweet Salad,Dinner,Spanish,Vegetarian,Hard,68,199,267,12,549,77.6,42.8,72.8,2.5,355,"tomatoes, cinnamon, basil","microwave, air fryer",Sarah Wilson,
RCP03776,Spicy Grilled,Dinner,Mexican,Low-Carb,Medium,90,168,258,,1019,61.7,41,29,4.5,3288,,pressure cooker,David Lee,19/06/2025
RCP03777,Rice Bowl,Appetizer,Chinese,None,Hard,120,75,195,5,364,40,,82.2,1.5,4856,zucchini; garlic; lettuce; salt; paprika; oregano,mixer,Sarah Wilson,19/03/2025
RCP03778,Spicy Bread,Breakfast,Thai,Paleo,Expert,97,59,156,3,419,5.8,76.4,72.1,1.1,-5,"lamb, potatoes, tomatoes, oats, cinnamon, cumin, thyme","slow cooker, blender",,05/06/2023
RCP03779,Crispy Smoothie,Breakfast,Chinese,None,Hard,86,22,108,1,88,57.9,141.9,79.9,2.1,69,"spinach, lettuce, zucchini, garlic, rice, thyme, paprika, salt",air fryer,Mary Smith,12/12/2023
RCP03780,Noodles,Appetizer,Vietnamese,None,Expert,119,186,305,6,198,-4.5,28.3,71.9,-0.3,2822,"cauliflower, pasta, butter, paprika, cinnamon","oven, pressure cooker, stovetop, food processor",Emily Chen,06/08/2024
RCP03781,Tangy Roast,Beverage,Vietnamese,None,Hard,91,99,190,2,1191,8.5,98.1,67.2,1.5,4236,"tofu, onions, bell peppers, cauliflower, mushrooms, cumin, pepper, thyme",slow cooker,Chef John,02/07/2024
RCP03782,Tangy Bread,Lunch,Chinese,Vegan,Expert,10,84,94,2,402,19.9,144,61.6,4.2,1054,"shrimp, onions, cauliflower, zucchini, spinach, quinoa, oregano",mixer,Chef John,07/09/2024
RCP03783,Spicy Baked,Beverage,Mediterranean,None,Medium,76,72,148,2,1062,,62.7,71.1,2.4,3560,"tofu, garlic, lettuce, onions, potatoes, flour, milk, oregano, cumin, salt, cinnamon","slow cooker, air fryer",Mary Smith,01/02/2023
RCP03784,Crispy Sandwich,Snack,Italian,None,Medium,98,35,133,12,67,63,90.7,65.3,1.8,1787,"chicken, zucchini, cumin, thyme, basil",food processor,mary smith,07/10/2024
RCP03785,Tacos,Salad,Korean,None,Hard,58,162,220,9,11477,-4.4,106.6,38.1,1.9,2339,"pork, onions, carrots, bell peppers, potatoes, oats, cumin, cinnamon, thyme, paprika","blender, grill, food processor",,18/06/2023
RCP03786,Spicy Soup,Lunch,Indian,None,Expert,36,84,120,2,443,1.5,141.7,62,4.7,143,"BROCCOLI, POTATOES, TOMATOES, SPINACH, BUTTER, OREGANO",,Mary Smith,29/01/2024
RCP03787,Spicy Tacos,Beverage,Vietnamese,None,Hard,577,2178,2755,-3,1166,48.8,118.6,33.1,4.4,2320,"tomatoes, mushrooms, noodles, cumin, oregano","blender, pressure cooker",Mary Smith,23/10/2024
RCP03788,Tangy Sandwich,Dinner,Thai,None,Medium,77,156,233,7,871,13.9,105.7,,2,3936,"bell peppers, carrots, potatoes, paprika, cinnamon","blender, pressure cooker, food processor",mary smith,11/11/2025
RCP03789,Sweet Roast,Dinner,Vietnamese,None,Medium,38,35,73,1,477,40.2,7.9,51.1,4,1757,"chicken, mushrooms, zucchini","air fryer, slow cooker",emily chen,29/08/2024
RCP03790,Savory Pasta,Breakfast,Japanese,None,Hard,112,136,248,10,712,54.2,,72.6,1.1,3634,"garlic, bell peppers, quinoa","mixer, air fryer, microwave, oven",mary smith,02/11/2024
RCP03791,Creamy Cake,Beverage,Vietnamese,None,Expert,114,91,205,10,315,19,-2,79.4,3.6,3843,"zucchini, spinach, mushrooms, lettuce, noodles, basil, salt, cinnamon","grill, slow cooker, stovetop, mixer",Mary Smith,15/01/2026
RCP03792,Sweet Casserole,Salad,Vietnamese,None,Hard,22,84,106,5,698,18.2,26.6,79,,4547,"turkey, mushrooms, salt, paprika, pepper, cinnamon",blender,David Lee,05/01/2025
RCP03793,Creamy Fried,Dessert,French,None,Expert,39,132,171,-1,697,37.2,120.7,2.1,1.5,510,"pork, cauliflower, potatoes, zucchini, basil, salt, cinnamon",air fryer,Bob Johnson,22/06/2024
RCP03794,Creamy Cake,Dinner,Vietnamese,Low-Carb,Easy,81,191,272,4,813,38.5,63.4,,1.1,1349,zucchini; bell peppers; carrots; milk; cinnamon; pepper; thyme; basil,"oven, mixer, grill",Mary Smith,26/08/2025
RCP03795,Savory Curry,Lunch,Greek,None,Expert,115,102,217,11,240,55.4,53.4,39.4,,991,"tofu, carrots, noodles, thyme, pepper","stovetop, food processor, grill",emily chen,06/08/2025
RCP03796,Spicy Stir-fry,Dessert,Spanish,Gluten-Free,Expert,63,215,278,9,736,45,130.5,12.7,1.2,4845,"bell peppers, quinoa, oregano, salt",oven,chef john,26/03/2023
RCP03797,Spicy Fried,Dinner,Chinese,Low-Carb,Hard,70,149,219,12,,-6.8,12.3,86,1.1,1241,"fish, carrots, bell peppers, cauliflower, onions, butter, pepper, thyme, basil","grill, blender",chef john,15/09/2023
RCP03798,Fried,Salad,Indian,None,Expert,102,107,209,11,550,,12.8,,1.9,2177,"bell peppers, zucchini, garlic, broccoli, yogurt, basil, salt, cinnamon",air fryer,CHEF JOHN,16/12/2024
RCP03799,Crispy Steamed,Breakfast,Vietnamese,Gluten-Free,Hard,58,182,240,6,1106,8.1,,76.7,3.6,2101,"TURKEY, CARROTS, ONIONS, SPINACH, BELL PEPPERS, RICE","grill, air fryer",Mary Smith,28/10/2023
RCP03800,Tangy Steamed,Appetizer,Korean,None,Hard,55,131,186,2,-54,41.7,95.4,25.8,2.3,64,pork; garlic; quinoa; yogurt; salt; basil; pepper; paprika,"pressure cooker, stovetop, mixer, oven",mary smith,14/08/2024
RCP03801,Spicy Pizza,Snack,Greek,Vegan,Expert,42,168,210,7,883,23.2,133,57.6,1.1,4125,"fish, spinach, mushrooms, potatoes, cinnamon","grill, mixer",chef john,25/06/2023
RCP03802,Herb Cake,Snack,Chinese,Vegetarian,Easy,100,36,136,9,856,33.6,8.3,13.3,4.9,4052,"tofu, cauliflower, onions, zucchini, butter, cinnamon, cumin",stovetop,David Lee,27/08/2024
RCP03803,Savory Pie,Breakfast,French,None,Hard,51,142,193,5,135,55.1,107.7,93.1,2.9,1600,"CHICKEN, MUSHROOMS, LETTUCE, BROCCOLI, CAULIFLOWER, PASTA, OREGANO, CINNAMON, PAPRIKA","oven, microwave, grill, pressure cooker",mary smith,14/09/2023
RCP03804,Herb Grilled,Breakfast,Mediterranean,None,Easy,86,52,138,4,179,33.2,31.9,30.9,3.2,3450,"chicken, zucchini, onions, pepper, paprika, oregano","grill, pressure cooker",Chef John,01/05/2025
RCP03805,Sweet Soup,Breakfast,French,None,Medium,6,34,40,8,579,23.4,9.2,35.2,1.4,1874,"GARLIC, LETTUCE, THYME, PEPPER",grill|air fryer|food processor|pressure cooker,David Lee,04/12/2024
RCP03806,Tacos,Salad,Vietnamese,Paleo,Hard,84,42,126,1,962,8.4,36.8,47.7,1.5,4359,"fish, mushrooms, broccoli, zucchini, cinnamon, cumin, paprika","pressure cooker, food processor, oven",David Lee,27/10/2025
RCP03807,Herb Fried,Dinner,Vietnamese,None,Medium,34,200,234,2,516,76.1,97.8,29.3,2.2,3602,"onions, oats, salt, cumin","mixer, oven, microwave, grill",emily chen,07/10/2024
RCP03808,Fried,Dinner,Japanese,None,Expert,5,138,143,1,120,32.9,76.4,,3.7,2511,"onions, spinach, garlic, potatoes, noodles, milk, thyme, oregano, paprika, salt","blender, microwave",,02/08/2024
RCP03809,Spicy Pasta,Snack,American,None,Medium,53,141,194,5,664,42,107.3,36.1,3.8,4066,,"microwave, oven, pressure cooker, slow cooker",mary smith,15/06/2025
RCP03810,Savory Salad,Dessert,Italian,None,Hard,16,33,49,5,132,65,1,45.9,2.5,1822,"pork, broccoli, pasta, paprika, thyme","slow cooker, grill, microwave",Mary Smith,28/11/2024
RCP03811,Creamy Steamed,Breakfast,Indian,Keto,Hard,108,13,121,9,961,-7.1,34.9,50.4,4.7,4320,"BEEF, LETTUCE, ZUCCHINI, QUINOA, PEPPER, CUMIN","food processor, blender, microwave, pressure cooker",David Lee,
RCP03812,Sweet Curry,Beverage,American,Vegan,Expert,42,169,211,,565,68.2,140.3,87.2,3.4,4894,"tofu, potatoes, broccoli, flour",pressure cooker|stovetop|grill,Emily Chen,28/10/2025
RCP03813,Herb Curry,Dinner,Vietnamese,None,Hard,9,162,171,3,862,66.4,45.4,52.1,2.1,563,"pork, tomatoes, onions, bell peppers, yogurt",oven,Mary Smith,29/08/2023
RCP03814,Crispy Tacos,Dinner,Korean,None,Expert,88,179,267,10,531,,129.4,28,4,3623,"carrots, salt, basil, cinnamon, thyme","stovetop, grill, food processor",mary smith,21/06/2024
RCP03815,Spicy Salad,Dinner,Greek,Dairy-Free,Easy,6,154,160,10,326,2.4,45.3,80.6,2.3,510,"beef, lettuce, cauliflower, zucchini",food processor,mary smith,21/11/2024
RCP03816,Sweet Cookies,Lunch,Italian,Dairy-Free,Expert,94,16,110,2,1060,27.2,120.5,7.8,3.4,1424,"CARROTS, LETTUCE, SPINACH, TOMATOES, NOODLES, PEPPER, CINNAMON, OREGANO","food processor, slow cooker, mixer, grill",Sarah Wilson,10/12/2024
RCP03817,Crispy Salad,Dinner,Vietnamese,None,Medium,38,106,144,9,1147,77.8,,,,2953,"bell peppers, potatoes, yogurt, cinnamon, paprika, pepper, thyme",,Bob Johnson,18/03/2024
RCP03818,Savory Sandwich,Breakfast,Mediterranean,None,Easy,18,44,62,3,1137,4.9,95.4,98.9,,,potatoes; lettuce; garlic; zucchini; noodles; paprika; oregano; pepper,"blender, microwave, grill",chef john,03/01/2024
RCP03819,Bread,Appetizer,Chinese,None,Hard,110,48,158,3,644,52.1,,,4.5,4717,"turkey, spinach, carrots, zucchini, flour, oregano, cinnamon","oven, grill, pressure cooker",mary smith,03/12/2023
RCP03820,Sweet Roast,Breakfast,Japanese,Vegan,Hard,94,195,289,5,101,71.6,122.9,69.3,3.9,1599,"eggs, zucchini, broccoli, quinoa, yogurt",mixer,Mary Smith,05/12/2025
RCP03821,Herb Salad,Snack,American,None,Hard,113,78,191,7,163,42.4,22.2,88.9,1.6,591,"lamb, garlic, tomatoes, yogurt, paprika, salt","stovetop, air fryer, grill, oven",mary smith,28/05/2023
RCP03822,Savory Bread,Dinner,Mediterranean,None,Easy,12,174,186,1,837,,67.3,22.3,2.4,3024,"chicken, mushrooms, broccoli","grill, blender",chef john,10/11/2024
RCP03823,Sweet Rice Bowl,Dinner,Chinese,Low-Carb,Easy,21,69,90,12,406,80,77.4,68.6,4,3604,"tofu, potatoes, onions, bread","slow cooker, food processor",Mary Smith,18/10/2025
RCP03824,Tangy Cake,Salad,Greek,Gluten-Free,Expert,58,56,114,4,191,11,121,99.6,,2317,"fish, spinach, lettuce, carrots, pepper, basil, salt, paprika","slow cooker, food processor",Sarah Wilson,
RCP03825,Creamy Cake,Dinner,Japanese,None,Medium,110,176,286,11,773,71.2,94.6,2.3,2.8,4615,"beef, spinach, tomatoes, zucchini, cinnamon, cumin","oven, pressure cooker",Sarah Wilson,16/05/2024
RCP03826,Sweet Curry,Lunch,Mediterranean,None,Expert,104,231,335,,414,53.5,50.9,94.2,2.2,233,"broccoli, potatoes, mushrooms, quinoa, cream, salt, cumin","food processor, blender, slow cooker, microwave",Mary Smith,26/05/2025
RCP03827,Spicy Smoothie,Dessert,Japanese,None,Expert,71,209,280,9,473,23.9,113.8,-1.9,3.7,3671,"tofu, mushrooms, lettuce, potatoes, rice, cream, paprika","stovetop, mixer",,13/03/2023
RCP03828,Savory Grilled,Salad,Spanish,Vegan,Medium,105,184,289,12,671,40.2,22.6,72.8,4.1,4255,"SPINACH, OREGANO, CINNAMON, CUMIN","pressure cooker, stovetop",,02/11/2025
RCP03829,Spicy Tacos,Dessert,Spanish,Low-Carb,Easy,107,208,315,2,635,72.8,6.9,99.1,1.5,658,"eggs, lettuce, pepper, oregano, salt",oven,chef john,05/01/2024
RCP03830,Salad,Breakfast,Mediterranean,Low-Carb,Easy,-15,-13,-28,8,217,39.8,19,71.4,2.2,2587,"potatoes, rice, paprika, salt, cumin","oven, pressure cooker, grill, food processor",chef john,
RCP03831,Soup,Beverage,Korean,Gluten-Free,Medium,111,46,157,2,-82,79.2,145.8,44.3,1.8,1729,tofu; mushrooms; bell peppers; broccoli; quinoa; basil; salt; cumin,"slow cooker, grill",Emily Chen,12/04/2024
RCP03832,Crispy Cookies,Breakfast,Mediterranean,None,Easy,34,196,230,7,1081,58.9,50.4,51.4,3.1,1310,"cauliflower, carrots, quinoa, cream, thyme, oregano, paprika, cinnamon","stovetop, pressure cooker",mary smith,07/07/2025
RCP03833,Crispy Salad,Dinner,Mediterranean,Dairy-Free,Expert,21,159,180,5,293,58.1,32.2,29.1,5,3181,"pork, mushrooms, potatoes, onions","pressure cooker, oven, microwave",Sarah Wilson,05/04/2024
RCP03834,Tangy Salad,Snack,Thai,None,Easy,23,224,247,4,670,-2.3,99.5,63.9,,3029,"chicken, spinach, broccoli, onions, lettuce, yogurt, cumin, oregano","mixer, air fryer, food processor",Chef John,02/03/2025
RCP03835,Smoothie,Dessert,Korean,Keto,Hard,51,54,105,2,603,74.6,,87.6,,3608,"lettuce, garlic, rice, basil, pepper","stovetop, grill, oven",Sarah Wilson,
RCP03836,Savory Steamed,Dessert,Mediterranean,None,Hard,,,,5,825,23.8,58.9,49.2,4,3824,pork; tomatoes; bell peppers,"slow cooker, stovetop, grill, mixer",emily chen,09/03/2024
RCP03837,Herb Stir-fry,Dinner,Vietnamese,Low-Carb,Expert,27,166,193,7,888,21.5,77.6,34.7,3.6,426,,pressure cooker|food processor,Bob Johnson,03/11/2024
RCP03838,Herb Noodles,Dessert,American,None,Hard,,,,8,681,70.9,100.2,57,,3785,"tomatoes, flour, butter, oregano, thyme, basil",mixer,CHEF JOHN,05/11/2024
RCP03839,Sweet Pie,Salad,French,None,Hard,13,210,223,8,585,12.4,46,-6,2.8,4171,"potatoes, mushrooms, lettuce, quinoa, butter, paprika, cumin","grill, food processor",Mary Smith,15/02/2025
RCP03840,Creamy Sandwich,Snack,Spanish,Paleo,Hard,100,238,338,1,639,55,142.6,40.3,3.3,1964,"turkey, mushrooms, spinach, lettuce, bread, pepper, oregano","air fryer, mixer",David Lee,24/04/2023
RCP03841,Tangy Smoothie,Breakfast,Chinese,None,Medium,91,135,226,5,819,10.8,144,-7.6,3.5,1116,"garlic, carrots, paprika","grill, air fryer, pressure cooker",CHEF JOHN,02/08/2024
RCP03842,Tangy Salad,Snack,Mexican,None,Hard,50,90,140,4,209,8,141,27.8,2.1,2692,"beef, mushrooms, tomatoes, spinach, thyme, pepper","grill, stovetop",Mary Smith,24/01/2025
RCP03843,Herb Grilled,Lunch,French,None,Medium,115,142,257,5,493,39,53.7,59,2.1,1992,"shrimp, bell peppers, zucchini, garlic","mixer, air fryer, stovetop, food processor",David Lee,07/02/2025
RCP03844,Sweet Cake,Appetizer,Japanese,None,Hard,44,86,130,5,586,38.9,90.4,,1.5,,zucchini; bread; pepper; cinnamon; cumin; oregano,mixer,chef john,15/02/2023
RCP03845,Tangy Roast,Snack,Vietnamese,None,Easy,52,21,73,11,108,6.9,66.4,2.3,3.7,379,"SHRIMP, BROCCOLI, LETTUCE, NOODLES, OREGANO, SALT, CUMIN, CINNAMON","air fryer, stovetop, food processor",David Lee,20/12/2025
RCP03846,Savory Grilled,Salad,Korean,None,Easy,117,132,249,4,764,39.5,,18.4,2.4,2111,"chicken, bell peppers, paprika, oregano",microwave,CHEF JOHN,16/10/2025
RCP03847,Herb Grilled,Beverage,American,Vegetarian,Easy,58,182,240,11,606,6.5,16.7,73,3.2,4049,"GARLIC, CAULIFLOWER, SPINACH, BREAD, PEPPER, OREGANO","air fryer, microwave, food processor, blender",Bob Johnson,01/07/2023
RCP03848,Herb Salad,Dessert,Japanese,None,Hard,84,35,119,1,63,42.2,126.2,92.6,,3123,"mushrooms, onions, garlic, noodles, basil","food processor, oven",chef john,10/11/2025
RCP03849,Herb Cake,Appetizer,Japanese,None,Hard,21,118,139,6,203,,96.7,61,1.5,255,"chicken, mushrooms, zucchini, garlic, cumin, paprika, cinnamon","oven, microwave",Emily Chen,26/06/2023
RCP03850,Creamy Bread,Lunch,Italian,None,Hard,85,87,172,5,11826,34.4,70.9,83.1,3.8,3638,turkey; carrots; potatoes; tomatoes; bell peppers; basil,"pressure cooker, food processor",,23/09/2024
RCP03851,Creamy Baked,Snack,Chinese,None,Easy,39,208,247,10,1055,37.4,89.5,1.3,2.8,832,"SPINACH, GARLIC, POTATOES, CAULIFLOWER, RICE, PEPPER, SALT",oven,Sarah Wilson,23/06/2023
RCP03852,Crispy Fried,Dessert,Spanish,Keto,Easy,62,27,89,9,,33.2,,9.5,4.5,1352,"turkey, mushrooms, zucchini, rice, milk, oregano, paprika",oven,David Lee,06/02/2025
RCP03853,Herb Pizza,Dinner,Mexican,None,Expert,46,71,117,7,931,68.7,,87.5,2.3,1694,lettuce; mushrooms; spinach; potatoes; bread; cream; basil; cinnamon; cumin,food processor|slow cooker,emily chen,29/07/2024
RCP03854,Sweet Curry,Salad,Chinese,None,Easy,66,108,174,12,424,74.4,120.7,83.1,2.2,2700,"garlic, zucchini, quinoa",pressure cooker|blender|mixer|microwave,chef john,09/03/2023
RCP03855,Savory Fried,Lunch,Mexican,None,Medium,43,200,243,9,1122,32.7,,51,4.7,1192,"tofu, bell peppers, onions, zucchini, cheese, cinnamon, oregano, basil, salt",mixer,Mary Smith,10/07/2025
RCP03856,Sweet Rice Bowl,Snack,Mediterranean,None,Easy,86,14,100,9,223,35.7,146.5,58.8,4,1516,"shrimp, spinach, carrots, cinnamon, salt, cumin",,CHEF JOHN,10/01/2024
RCP03857,Savory Steamed,Appetizer,Korean,None,Hard,11,28,39,1,611,39.6,88.7,81.1,1.3,3169,tofu; tomatoes; mushrooms; oats; milk,"oven, air fryer",mary smith,20/02/2023
RCP03858,Herb Cake,Dinner,Greek,None,Expert,88,39,127,5,492,42.8,131.9,32.2,2.2,118,"spinach, bread, pepper, cumin","air fryer, microwave, mixer, oven",mary smith,15/12/2024
RCP03859,Cake,Beverage,Thai,None,Medium,50,183,233,2,789,50,42.6,93.7,1.8,4261,beef; zucchini; cream; paprika; salt,"microwave, pressure cooker, mixer, grill",mary smith,29/07/2023
RCP03860,Baked,Snack,French,None,Expert,50,41,91,,1024,34.1,135,89.2,3.8,1251,eggs; onions; mushrooms; pasta; paprika; basil; oregano,"microwave, slow cooker, food processor",Emily Chen,12/05/2023
RCP03861,Tacos,Breakfast,French,None,Medium,21,131,152,4,308,,89.7,51.3,1.5,1398,"tofu, potatoes, zucchini, mushrooms, oats, yogurt, thyme, cumin, paprika","stovetop, grill",Chef John,28/01/2025
RCP03862,Spicy Pie,Appetizer,Italian,None,Easy,91,67,158,1,-123,7,26.7,1.8,3,,"potatoes, zucchini, cauliflower, bread, oregano, paprika","grill, oven, food processor, stovetop",Emily Chen,26/11/2023
RCP03863,Spicy Rice Bowl,Beverage,Korean,Gluten-Free,Medium,52,62,114,9,9775,46.2,16.1,73.3,1.1,2335,"shrimp, garlic, pasta, basil, pepper, oregano","blender, grill, food processor, microwave",chef john,19/04/2025
RCP03864,Cookies,Lunch,Greek,Gluten-Free,Easy,72,125,197,11,986,68.9,132.4,18.7,,512,"fish, onions, cauliflower",slow cooker|air fryer|food processor,Emily Chen,28/12/2025
RCP03865,Sweet Smoothie,Beverage,French,None,Hard,40,135,175,4,1114,2.1,111.1,35.2,1.8,607,"shrimp, garlic, tomatoes, potatoes, oats, milk, pepper",stovetop,David Lee,13/02/2024
RCP03866,Savory Roast,Appetizer,Mediterranean,None,Easy,70,48,118,4,1163,34.1,53.6,97.3,4.4,3270,"fish, mushrooms, potatoes, onions, paprika, thyme","food processor, grill, pressure cooker",chef john,02/06/2023
RCP03867,Tangy Soup,Beverage,Japanese,None,Easy,65,139,204,9,987,47.6,24.8,64.6,2.9,2855,beef; mushrooms; bell peppers; carrots; cream; thyme; cinnamon; paprika,"blender, food processor, microwave",Chef John,01/04/2023
RCP03868,Spicy Smoothie,Dinner,Greek,None,Expert,78,174,252,9,85,-7.7,,30.7,3.5,1384,"fish, garlic, noodles, oregano","grill, mixer",Chef John,27/10/2025
RCP03869,Crispy Pie,Beverage,Japanese,None,Medium,71,113,184,,185,,125.5,27.5,1.2,3113,"turkey, onions, bell peppers, oregano, salt, paprika, cinnamon",stovetop,Mary Smith,
