recipe_id,recipe_name,category,cuisine,dietary_restrictions,difficulty,prep_time_mins,cook_time_mins,total_time_mins,servings,calories,protein_g,carbs_g,fat_g,rating,num_reviews,ingredients,equipment_needed,author,date_added
RCP02489,Tangy Sandwich,Appetizer,Mexican,Paleo,Easy,74,116,190,2,727,30.9,86,58.4,1,1096,"tofu, mushrooms, lettuce, pasta, cream, basil, cumin, oregano, thyme","stovetop, pressure cooker, air fryer",emily chen,27/06/2024
RCP02490,Grilled,Lunch,Greek,Keto,Expert,-5,-48,-53,9,1096,74.5,49.4,88.6,2.7,1440,"pork, cauliflower, onions, lettuce, tomatoes, noodles, salt, thyme, cumin, cinnamon","air fryer, oven, stovetop",Sarah Wilson,02/12/2024
RCP02491,Spicy Roast,Breakfast,Vietnamese,None,Expert,53,99,152,7,841,37.7,135.2,-9.8,2.1,4962,"fish, lettuce, zucchini, basil, cinnamon",,Bob Johnson,11/01/2024
RCP02492,Crispy Steamed,Snack,French,Gluten-Free,Expert,45,141,186,8,566,53.3,,43.8,1.3,3969,"turkey, mushrooms, spinach, rice, salt, basil, cinnamon","stovetop, mixer",Emily Chen,10/08/2023
RCP02493,Sweet Salad,Salad,Vietnamese,None,Medium,60,156,216,6,876,24.8,15,17.4,3.6,4545,"beef, spinach, potatoes, onions, cauliflower, bread, cream","mixer, blender",Sarah Wilson,05/10/2023
RCP02494,Savory Roast,Lunch,Chinese,Dairy-Free,Expert,109,36,145,9,1101,21,107,20,5,3595,"shrimp, spinach, salt, basil, paprika",food processor,CHEF JOHN,29/01/2026
RCP02495,Savory Pasta,Beverage,Italian,None,Medium,62,202,264,8,606,48.4,83.6,6.9,4.6,4575,"cauliflower, mushrooms, broccoli, potatoes, flour, salt, paprika","mixer, grill, blender",David Lee,28/12/2024
RCP02496,Spicy Stir-fry,Snack,American,Low-Carb,Hard,99,177,276,,273,1,124.2,12.6,1.4,4189,"chicken, lettuce, thyme, pepper","mixer, food processor",David Lee,12/09/2024
RCP02497,Creamy Smoothie,Salad,Indian,None,Hard,104,162,266,4,916,24.6,18,2,,972,"tofu, potatoes, carrots, pasta, yogurt",blender,Bob Johnson,25/04/2023
RCP02498,Crispy Steamed,Lunch,Indian,None,Hard,6,165,171,10,344,57.7,107.7,62.6,2.8,495,"tofu, lettuce, garlic, potatoes, spinach, flour, pepper, cinnamon, oregano","pressure cooker, microwave, mixer, slow cooker",Emily Chen,13/04/2023
RCP02499,Crispy Curry,Beverage,Greek,None,Expert,-21,-59,-80,9,100,24.6,118.6,52.8,1.1,2944,"tofu, cauliflower, mushrooms, broccoli, yogurt, oregano, cinnamon","slow cooker, grill",chef john,30/12/2025
RCP02500,Herb Sandwich,Beverage,Italian,None,Medium,85,177,262,11,194,79.1,0.3,42.8,1.8,1468,"shrimp, bell peppers, cauliflower, spinach, garlic, bread, milk, paprika, oregano, pepper, basil","stovetop, food processor, pressure cooker, microwave",Bob Johnson,26/11/2023
RCP02501,Savory Pasta,Lunch,Chinese,None,Easy,,,,11,1187,47.2,129.4,29.1,3,4696,lamb; potatoes; garlic; quinoa; oregano,oven|stovetop,David Lee,05/04/2023
RCP02502,Savory Pizza,Snack,Indian,Dairy-Free,Expert,39,194,233,7,939,68.2,76.7,63.2,1.6,3278,"turkey, broccoli, flour, oregano, salt, paprika","air fryer, mixer",,13/03/2023
RCP02503,Sweet Cookies,Salad,Japanese,None,Expert,42,193,235,4,,76.3,149.1,26.9,4.3,2748,"eggs, cauliflower, bell peppers, mushrooms",oven,CHEF JOHN,10/08/2024
RCP02504,Spicy Pie,Appetizer,Indian,None,Expert,534,4474,5008,9,395,60.8,44.7,42.1,4.3,3540,"beef, zucchini, spinach","microwave, pressure cooker, stovetop",Sarah Wilson,07/04/2024
RCP02505,Sweet Casserole,Dinner,Japanese,None,Medium,67,114,181,10,545,71.4,125.2,86,2.1,2154,potatoes; garlic; spinach; rice; oregano; pepper,"oven, air fryer, stovetop, pressure cooker",chef john,26/09/2025
RCP02506,Crispy Curry,Dinner,French,None,Easy,53,201,254,12,1105,58.6,106.7,,3.5,3589,"turkey, carrots, salt, paprika","slow cooker, grill, blender",CHEF JOHN,06/04/2023
RCP02507,Sweet Bread,Breakfast,Korean,None,Easy,80,128,208,10,678,25.4,,35.3,4.9,1087,"garlic, zucchini, spinach","microwave, mixer, stovetop, slow cooker",Mary Smith,26/03/2025
RCP02508,Grilled,Salad,Japanese,None,Expert,18,234,252,9,943,6.1,83.2,86.5,3.2,4160,"CHICKEN, CARROTS, BELL PEPPERS, TOMATOES, MUSHROOMS, CINNAMON",air fryer|oven|grill,mary smith,01/20/2025
RCP02509,Cake,Snack,Italian,None,Hard,113,110,223,9,1185,21.2,23.1,95.3,1.5,3168,"beef, broccoli, yogurt, thyme","oven, stovetop",chef john,13/04/2025
RCP02510,Creamy Cake,Appetizer,Mediterranean,None,Hard,103,205,308,1,530,64.9,20.1,10,3.8,3293,"pork, tomatoes, potatoes, cauliflower, broccoli, basil, oregano","stovetop, microwave, food processor, blender",David Lee,22/08/2025
RCP02511,Spicy Tacos,Snack,Japanese,Paleo,Medium,97,16,113,11,827,72.3,64,72,3.6,324,"cauliflower, mushrooms, flour, salt, basil","grill, air fryer, pressure cooker, microwave",CHEF JOHN,10/03/2024
RCP02512,Savory Pie,Breakfast,Japanese,None,Easy,118,82,200,9,-73,9.6,74,83.9,2.1,4462,"lamb, broccoli, rice, cheese, paprika, thyme, salt","pressure cooker, food processor, blender",Bob Johnson,15/12/2023
RCP02513,Tangy Grilled,Breakfast,Mexican,None,Expert,1773,3626,5399,5,742,32.9,35.8,42.1,1.1,3712,"GARLIC, LETTUCE, BROCCOLI, CHEESE, OREGANO, PEPPER, CUMIN","pressure cooker, microwave, mixer, food processor",Sarah Wilson,19/11/2024
RCP02514,Tangy Noodles,Snack,Indian,None,Hard,51,196,247,4,218,67.4,102,14.4,4.2,3952,"lamb, potatoes, cheese, cumin, cinnamon, paprika","mixer, oven, stovetop",mary smith,2024.12.19
RCP02515,Tangy Bread,Beverage,Thai,None,Medium,54,205,259,10,844,44.4,134.3,45.6,3.9,3417,"chicken, bell peppers, mushrooms, zucchini, quinoa, pepper, thyme, cumin, paprika","stovetop, air fryer, oven",mary smith,08/10/2025
RCP02516,Creamy Bread,Appetizer,Indian,None,Easy,14,180,194,10,9461,34.1,135.2,31.3,1,,"onions, garlic, rice, paprika, pepper, salt","pressure cooker, mixer, air fryer",chef john,18/08/2024
RCP02517,Tangy Salad,Lunch,Mediterranean,None,Expert,108,142,250,10,754,,113.5,42.8,,3349,"spinach, cauliflower, zucchini, tomatoes, cream, thyme, paprika",stovetop,David Lee,25/06/2024
RCP02518,Creamy Rice Bowl,Beverage,Japanese,None,Hard,70,209,279,12,1167,-5.9,138.3,53.2,4,,"lamb, zucchini, tomatoes, thyme, cumin","pressure cooker, blender, air fryer, slow cooker",Emily Chen,20/12/2024
RCP02519,Crispy Fried,Dinner,Italian,None,Medium,93,45,138,9,-71,29.4,69.1,70.5,2.8,3901,"fish, carrots, spinach, garlic, cauliflower, milk, basil, cinnamon, thyme","blender, mixer, grill, food processor",Bob Johnson,04/07/2023
RCP02520,Creamy Soup,Dessert,Japanese,Vegan,Expert,86,193,279,,834,37.2,21.5,22.3,4.8,1506,beef; zucchini; oats; butter; basil; salt; cinnamon; paprika,"mixer, stovetop, food processor",mary smith,30/03/2023
RCP02521,Baked,Breakfast,Spanish,None,Easy,,,,7,924,6.3,5.1,18.2,4.6,,"SHRIMP, SPINACH, ZUCCHINI, MUSHROOMS, BUTTER, THYME, PEPPER, PAPRIKA, CUMIN",grill,mary smith,01/06/2024
RCP02522,Savory Tacos,Snack,Japanese,None,Expert,49,230,279,4,108,38.7,76.1,-11.9,4.4,3505,"broccoli, lettuce, salt, cinnamon","grill, food processor, oven, air fryer",Emily Chen,03/04/2024
RCP02523,Creamy Salad,Salad,Japanese,None,Expert,47,229,276,2,655,4.2,36.9,66.4,4.6,750,"shrimp, lettuce, garlic, carrots, butter, oregano, cinnamon",oven|blender|stovetop,CHEF JOHN,22/02/2023
RCP02524,Savory Roast,Dinner,Italian,None,Easy,94,214,308,6,,21.5,2.4,97.8,4.4,1482,"pork, potatoes, bell peppers, spinach, quinoa, basil, cinnamon","oven, air fryer",Emily Chen,12/09/2025
RCP02525,Savory Cake,Appetizer,Mexican,None,Easy,52,124,176,-2,559,33.4,,46.5,4.6,487,"turkey, mushrooms, garlic, bell peppers, carrots","grill, pressure cooker, blender",Bob Johnson,23/07/2024
RCP02526,Savory Cookies,Breakfast,Korean,None,Expert,15,132,147,4,386,28.8,,34.2,1.3,2436,"tofu, carrots, pasta, thyme, cinnamon, salt","food processor, mixer, blender, pressure cooker",Mary Smith,25/07/2024
RCP02527,Sweet Pizza,Breakfast,French,None,Easy,50,35,85,4,,69.9,93.8,63.1,1.4,4110,"lettuce, potatoes, thyme, oregano, basil, pepper","food processor, oven, grill, air fryer",Emily Chen,09/12/2025
RCP02528,Cookies,Snack,Japanese,Vegan,Expert,13,179,192,-5,11061,2.1,98.9,30.9,2.8,333,"zucchini, spinach, cheese, cumin, basil","blender, grill, air fryer, food processor",mary smith,14/07/2023
RCP02529,Creamy Fried,Appetizer,Spanish,None,Hard,57,83,140,5,707,42.6,107.7,50.8,4.9,748,"fish, zucchini, potatoes, spinach, rice, milk, basil, salt, cumin","oven, mixer",Chef John,12/08/2024
RCP02530,Spicy Cake,Dessert,Italian,None,Medium,102,131,233,3,1109,,103,60,1.2,3677,,"slow cooker, mixer",David Lee,20/10/2023
RCP02531,Herb Pasta,Snack,Greek,None,Expert,55,238,293,9,592,26,64.1,43.3,1.2,2468,spinach; onions; oats; cream; cumin; thyme,"grill, oven, food processor",Bob Johnson,16/11/2023
RCP02532,Creamy Cake,Appetizer,Korean,None,Expert,69,181,250,11,567,10.1,58.4,33.6,3.4,3533,"eggs, mushrooms, lettuce, butter, cumin, cinnamon, pepper, basil","slow cooker, blender",Mary Smith,14/10/2023
RCP02533,Crispy Soup,Breakfast,Chinese,None,Hard,14,54,68,,743,78.2,119.1,24.8,1.9,4454,cauliflower; mushrooms; broccoli; pasta; paprika; basil,"mixer, microwave, grill, oven",CHEF JOHN,21/07/2023
RCP02534,Savory Pizza,Beverage,Thai,None,Easy,72,19,91,12,1032,42.6,50.8,58.8,2.7,3989,"bell peppers, lettuce, cheese, salt, basil, cinnamon, cumin",pressure cooker,Chef John,17/08/2023
RCP02535,Herb Roast,Breakfast,Vietnamese,None,Easy,102,34,136,0,89,36.7,25.4,,2,4177,"lamb, spinach, bell peppers, butter, salt, basil, cumin, oregano",air fryer,Sarah Wilson,17/09/2023
RCP02536,Tangy Sandwich,Dessert,Korean,Gluten-Free,Medium,120,142,262,5,984,2.9,29.7,60.3,2.7,4209,"SHRIMP, MUSHROOMS, PASTA, PAPRIKA, BASIL, OREGANO, CINNAMON","food processor, oven",Emily Chen,25/12/2025
RCP02537,Creamy Pasta,Salad,Spanish,None,Expert,25,78,103,10,306,14.4,98.5,17.5,2.1,703,"shrimp, spinach, lettuce, noodles, salt, paprika, cumin, basil","pressure cooker, stovetop, air fryer, oven",mary smith,25/11/2023
RCP02538,Crispy Cake,Salad,Indian,None,Medium,41,92,133,3,403,,57.5,84.6,2.6,3687,"shrimp, broccoli, onions, basil, salt, paprika, cinnamon",blender,mary smith,20/10/2025
RCP02539,Sweet Cookies,Breakfast,Mediterranean,None,Hard,15,119,134,11,,65.9,135.6,73.2,4.4,2419,"eggs, potatoes, mushrooms, spinach, quinoa","oven, microwave",David Lee,24/07/2025
RCP02540,Sweet Curry,Snack,French,None,Medium,77,224,301,10,523,32.2,132.5,15.4,2.1,1506,"beef, carrots, bell peppers, onions, cheese, basil, cinnamon",food processor,mary smith,09/10/2023
RCP02541,Savory Sandwich,Appetizer,Indian,Dairy-Free,Expert,29,163,192,1,1090,21.5,47.8,76.8,3.2,3051,"EGGS, LETTUCE, GARLIC, BROCCOLI, PAPRIKA, CUMIN, OREGANO, PEPPER",,mary smith,09/02/2024
RCP02542,Sweet Sandwich,Dessert,Spanish,Low-Carb,Easy,102,104,206,6,879,77.8,,,4.7,4267,"zucchini, broccoli, garlic, mushrooms","air fryer, stovetop",Emily Chen,16/08/2023
RCP02543,Spicy Casserole,Breakfast,Korean,Vegetarian,Easy,44,166,210,1,-135,1.7,76.8,28.3,4.2,4095,"carrots, garlic, onions, mushrooms, basil, thyme","air fryer, slow cooker, grill",mary smith,23/04/2024
RCP02544,Crispy Pasta,Dinner,Vietnamese,Dairy-Free,Medium,109,136,245,2,983,26.7,123,65.2,4.1,1445,"zucchini, broccoli, carrots, lettuce, cinnamon","stovetop, air fryer, oven, slow cooker",Sarah Wilson,07/11/2025
RCP02545,Sweet Pizza,Dessert,Spanish,None,Expert,47,202,249,7,204,59.3,84.8,95.3,3,,turkey; spinach; thyme; salt,,mary smith,12/07/2023
RCP02546,Soup,Breakfast,French,None,Hard,6,188,194,4,65,80,140.5,43.2,3.3,2990,"eggs, carrots, garlic, cheese, cinnamon, oregano",food processor,Bob Johnson,04/06/2025
RCP02547,Tangy Pizza,Dessert,Mexican,None,Medium,,,,1,88,41.8,89.9,54.2,2.9,4887,"turkey, zucchini, spinach, carrots, basil, salt, pepper","slow cooker, mixer",David Lee,01/07/2025
RCP02548,Crispy Pie,Appetizer,Chinese,Keto,Medium,76,176,252,6,-89,0,,90.4,1.9,,"mushrooms, cheese, salt, basil","stovetop, mixer",Sarah Wilson,10/07/2025
RCP02549,Spicy Fried,Dessert,Japanese,None,Medium,53,80,133,12,844,25.7,-6.6,22.1,2.1,4779,"potatoes, flour, basil, cinnamon, oregano",oven,CHEF JOHN,21/12/2025
RCP02550,Creamy Rice Bowl,Breakfast,Spanish,None,Hard,120,36,156,11,1022,,115.6,91.4,4.4,2711,"cauliflower, bell peppers, onions, zucchini, rice, milk, pepper","oven, stovetop",Sarah Wilson,29/11/2023
RCP02551,Pie,Breakfast,American,None,Medium,103,203,306,7,943,,-8.6,68.4,2.7,310,"turkey, potatoes, pepper, salt, thyme, paprika",oven|pressure cooker,Chef John,21/07/2025
RCP02552,Crispy Pie,Lunch,Japanese,None,Hard,57,197,254,5,1119,55.3,0.2,99.3,2.1,3946,potatoes; garlic; milk; paprika; cumin; basil,microwave,mary smith,27/07/2024
RCP02553,Savory Salad,Breakfast,Japanese,None,Medium,-25,-54,-79,12,280,35.9,4.6,21.1,2.4,266,,grill|food processor|slow cooker|pressure cooker,David Lee,06/12/2024
RCP02554,Herb Fried,Appetizer,Mediterranean,None,Hard,52,217,269,10,293,0.1,37.1,18.5,2.2,4336,zucchini; mushrooms; potatoes; cauliflower; butter; cinnamon; salt; paprika; cumin,air fryer,Mary Smith,
RCP02555,Crispy Salad,Appetizer,Greek,None,Expert,63,45,108,10,384,75,60.9,28.9,3.8,1573,garlic; quinoa; cheese; oregano; salt; paprika,"pressure cooker, blender, oven",Emily Chen,04/04/2025
RCP02556,Spicy Salad,Salad,Vietnamese,Vegetarian,Expert,,,,9,776,41.8,140,4.7,4.1,1989,"carrots, potatoes, mushrooms, cheese, thyme, cumin, oregano","pressure cooker, mixer, air fryer",Sarah Wilson,2023.03.23
RCP02557,Savory Bread,Dinner,Italian,Vegetarian,Medium,24,147,171,1,498,54.4,105.6,70.9,3.4,1439,"lamb, spinach, oats, pepper, salt, cinnamon, oregano",grill,emily chen,
RCP02558,Savory Fried,Lunch,Greek,None,Hard,6,144,150,,565,30.2,146.9,36.1,1.9,765,"ONIONS, CARROTS, TOMATOES, BASIL, CINNAMON","food processor, air fryer, stovetop, oven",mary smith,15/01/2026
RCP02559,Creamy Sandwich,Lunch,Thai,None,Expert,9,191,200,3,173,4.3,92,74.2,1.1,4799,"pork, tomatoes, potatoes, cauliflower, carrots, bread, salt, thyme","pressure cooker, stovetop",David Lee,12/14/2025
RCP02560,Creamy Grilled,Dinner,Greek,Vegan,Easy,101,231,332,5,288,72.4,136.4,93.6,1.6,571,"BELL PEPPERS, LETTUCE, BASIL, OREGANO","blender, food processor, stovetop",CHEF JOHN,14/06/2025
RCP02561,Sweet Pasta,Snack,Mexican,None,Medium,-23,-29,-52,10,101,23.7,122.7,5.2,3.1,4616,"fish, onions, broccoli, tomatoes, oats, thyme","blender, air fryer",emily chen,26/02/2023
RCP02562,Tacos,Dinner,Mexican,None,Expert,20,69,89,3,253,78.1,42.1,26,,4294,"turkey, zucchini, potatoes, pepper, salt, cumin","stovetop, blender, pressure cooker",David Lee,27/09/2025
RCP02563,Tangy Soup,Dessert,Korean,Low-Carb,Easy,-27,-49,-76,10,455,67.3,36.5,95.5,4.9,4622,"pork, garlic, cauliflower, spinach, noodles, cheese, paprika, thyme, cinnamon","stovetop, blender",Sarah Wilson,29/02/2024
RCP02564,Crispy Salad,Salad,Mexican,None,Hard,61,107,168,4,168,54.3,48.5,39.1,3.6,341,"lamb, spinach, zucchini, tomatoes, flour, yogurt, pepper, thyme","pressure cooker, slow cooker",Bob Johnson,04/04/2025
RCP02565,Herb Cake,Beverage,Chinese,None,Easy,8,58,66,,1003,37.3,93.8,71.4,3,1988,"fish, bell peppers, cheese, pepper, oregano, paprika, cumin","oven, food processor",CHEF JOHN,24/10/2024
RCP02566,Savory Cake,Beverage,Greek,None,Easy,47,154,201,12,984,6.4,-2.8,48.7,3.9,3422,pork; carrots; bread,"food processor, slow cooker, oven",emily chen,07/02/2025
RCP02567,Tangy Fried,Breakfast,Japanese,None,Easy,50,131,181,9,507,28.5,,11.5,4.7,547,"PORK, BELL PEPPERS, ONIONS, CAULIFLOWER, GARLIC, OATS, SALT, OREGANO","food processor, mixer, grill",chef john,22/09/2025
RCP02568,Sweet Smoothie,Beverage,Korean,None,Medium,69,238,307,3,,65.5,47.8,44.4,1.8,2843,"tofu, onions, spinach, mushrooms, cauliflower, noodles, thyme, cumin, basil","blender, stovetop, food processor, oven",CHEF JOHN,02/10/2024
RCP02569,Creamy Casserole,Beverage,Greek,None,Medium,9,226,235,10,1101,,86.8,6.2,4.4,4197,"potatoes, zucchini, noodles, oregano, cinnamon","mixer, slow cooker, air fryer, grill",David Lee,16/07/2023
RCP02570,Crispy Cookies,Breakfast,Vietnamese,Vegan,Hard,77,45,122,6,554,79,112.8,18.7,2.9,890,"spinach, bell peppers, cauliflower, rice, oregano, pepper, cumin, cinnamon",oven,David Lee,09/11/2025
RCP02571,Tangy Salad,Dinner,Thai,None,Hard,43,201,244,3,11313,56.2,47.3,-1,-1.2,,"mushrooms, spinach, cauliflower, cheese, paprika, salt","blender, slow cooker, oven, microwave",David Lee,16/04/2025
RCP02572,Tangy Pie,Salad,Italian,None,Medium,62,159,221,11,-106,,103.7,90.1,2.1,1598,tofu; carrots; pasta; thyme; pepper; basil; paprika,"food processor, blender",emily chen,2025.10.11
RCP02573,Tangy Noodles,Beverage,Japanese,None,Hard,60,56,116,10,839,,42.9,98.7,4.9,3378,"garlic, tomatoes, potatoes, salt, oregano",,mary smith,02/04/2025
RCP02574,Creamy Roast,Beverage,Thai,Vegan,Medium,97,205,302,6,984,65.1,78.9,,-1.8,4271,"lettuce, garlic, pasta, cumin, paprika, basil","oven, stovetop, food processor",Mary Smith,2024.02.17
RCP02575,Creamy Pizza,Appetizer,Mediterranean,None,Hard,36,207,243,,999,66.2,55.6,29,1,4230,"pork, cauliflower, carrots, paprika, cumin","slow cooker, stovetop",CHEF JOHN,06/04/2023
RCP02576,Herb Curry,Dinner,Greek,None,Hard,53,137,190,1,923,-7.6,,99.7,4.1,470,"cauliflower, onions, bell peppers, basil, thyme","blender, mixer, pressure cooker, oven",Mary Smith,02/02/2025
RCP02577,Tangy Grilled,Salad,Chinese,None,Medium,58,22,80,5,378,35.7,49.8,-8.2,2.4,441,"shrimp, onions, garlic, zucchini, lettuce, rice, salt, basil",food processor,Bob Johnson,11/06/2025
RCP02578,Crispy Steamed,Dinner,Thai,None,Medium,116,117,233,3,670,29.6,43.4,48.5,2.2,4093,"beef, cauliflower, tomatoes, pasta","air fryer, grill, mixer, stovetop",David Lee,03/05/2023
RCP02579,Creamy Baked,Breakfast,Italian,None,Hard,99,197,296,3,612,34.6,92.2,,-1.3,4846,"lamb, zucchini, carrots, potatoes, cauliflower, thyme, cumin",food processor,Chef John,06/08/2023
RCP02580,Spicy Roast,Dessert,Mediterranean,Low-Carb,Expert,84,107,191,3,569,-7.3,9.2,76.1,3.8,4771,"cauliflower, lettuce, broccoli, quinoa, oregano, thyme, cumin, cinnamon","blender, pressure cooker, air fryer, microwave",Mary Smith,27/04/2024
RCP02581,Herb Salad,Beverage,Thai,Paleo,Easy,100,98,198,4,,17.5,65.6,92,4.6,2549,"fish, carrots, garlic, bell peppers, tomatoes, cinnamon, salt","food processor, stovetop",,15/03/2023
RCP02582,Creamy Cake,Appetizer,Vietnamese,Vegan,Hard,116,38,154,10,342,74.3,141,,3.2,125,"lamb, bell peppers, pasta, cheese, oregano, pepper","microwave, air fryer, grill, pressure cooker",Bob Johnson,10/10/2023
RCP02583,Crispy Fried,Dessert,Mexican,None,Hard,25,27,52,-1,97,32.4,42.6,,1.5,1219,"garlic, noodles, cheese, salt, basil, paprika",food processor|grill,Chef John,12/10/2023
RCP02584,Savory Noodles,Beverage,Mexican,None,Expert,23,146,169,1,314,70.1,37.2,42.4,2.6,2481,"mushrooms, carrots, broccoli, rice, cinnamon, pepper, thyme",stovetop,Bob Johnson,
RCP02585,Savory Pie,Dinner,Mediterranean,None,Hard,54,88,142,11,270,47.5,33.5,94.4,2.7,4780,"tomatoes, pepper, thyme",air fryer,emily chen,18/04/2024
RCP02586,Tangy Cookies,Breakfast,Mexican,Vegan,Medium,54,121,175,2,691,2.1,8.3,62.7,1.2,1782,"carrots, bread, milk, basil, thyme","pressure cooker, mixer",Chef John,19/01/2024
RCP02587,Herb Noodles,Salad,Spanish,None,Medium,13,209,222,11,8106,50.6,31.9,59,3.1,2399,"shrimp, carrots, onions, zucchini, lettuce, quinoa, cream, pepper, basil",food processor,mary smith,17/08/2023
RCP02588,Creamy Casserole,Dessert,American,Gluten-Free,Hard,24,105,129,3,1100,74.8,87.7,32.5,1.5,4033,"garlic, mushrooms, lettuce, bell peppers, flour, pepper, oregano",,David Lee,30/03/2024
RCP02589,Crispy Smoothie,Snack,Thai,None,Expert,56,89,145,8,197,25.2,7,12.2,6.3,4413,"broccoli, potatoes, oregano, cumin",blender,chef john,06/11/2025
RCP02590,Herb Tacos,Dessert,Greek,None,Hard,97,126,223,11,602,51.2,70.6,4.1,2.9,2544,"eggs, lettuce, zucchini, broccoli, tomatoes","air fryer, grill, slow cooker",David Lee,16/01/2024
RCP02591,Tangy Curry,Beverage,Greek,None,Easy,-14,-55,-69,3,56,75.1,47.6,27.7,4.8,2634,shrimp; tomatoes; bread; milk; basil,microwave,Chef John,09/03/2024
RCP02592,Bread,Appetizer,Chinese,None,Hard,-20,-43,-63,12,1191,31.9,5.4,87.7,3.7,3755,"lettuce, onions, pasta, butter, salt, oregano, cinnamon","slow cooker, grill, microwave",Mary Smith,06/03/2024
RCP02593,Cake,Dinner,Spanish,Paleo,Hard,53,71,124,8,203,4.4,48.9,,4.5,2352,"onions, cheese, thyme","pressure cooker, grill, microwave",Bob Johnson,25/03/2025
RCP02594,Herb Noodles,Dinner,Japanese,Keto,Hard,100,166,266,1,1174,15.1,111.9,90.1,3.8,4046,"eggs, lettuce, cauliflower, mushrooms",blender,emily chen,05/10/2024
RCP02595,Sweet Bread,Breakfast,Korean,None,Easy,25,145,170,,56,29.9,90,25.3,2.8,1875,"tomatoes, potatoes, mushrooms, milk, thyme, cumin, oregano","air fryer, mixer, slow cooker",Bob Johnson,15/09/2025
RCP02596,Sweet Cookies,Appetizer,Chinese,None,Hard,70,198,268,10,,6.3,37.4,67.2,2.8,2780,"LAMB, ONIONS, CUMIN, OREGANO",grill,David Lee,17/08/2023
RCP02597,Creamy Salad,Appetizer,Italian,None,Easy,51,194,245,1,533,37,91.4,-7.4,2.3,2923,"cauliflower, broccoli, spinach, yogurt, oregano, cinnamon, paprika, salt",,emily chen,29/11/2023
RCP02598,Tangy Steamed,Dessert,Thai,None,Easy,-6,-32,-38,11,1050,70.8,14.9,70.7,1.9,,pork; garlic; broccoli; cinnamon; salt,"stovetop, air fryer, blender",chef john,27/09/2025
RCP02599,Tangy Casserole,Beverage,Mediterranean,None,Hard,-15,-57,-72,10,689,31.1,64.7,56.6,,873,"lamb, carrots, lettuce, broccoli, tomatoes, bread, paprika, salt, oregano, cinnamon","grill, food processor, pressure cooker, oven",,13/08/2023
RCP02600,Sweet Pizza,Appetizer,Korean,None,Easy,49,153,202,6,,67.8,61,,2.2,5,"zucchini, flour, thyme, salt, cumin",pressure cooker|grill,chef john,26/04/2025
RCP02601,Sweet Baked,Appetizer,Vietnamese,None,Expert,59,154,213,6,,42.2,124.9,61.2,1.4,-44,"cauliflower, quinoa, paprika, basil, oregano, cinnamon",slow cooker,,25/03/2025
RCP02602,Spicy Curry,Breakfast,Vietnamese,None,Medium,16,212,228,2,309,39.1,,13.9,2.6,2725,"TURKEY, ZUCCHINI, QUINOA, SALT, CUMIN","mixer, grill, pressure cooker",emily chen,19/03/2023
RCP02603,Salad,Lunch,Indian,None,Easy,,,,6,779,75.3,91.7,84,2.2,4142,"fish, potatoes, onions, bell peppers, oregano, pepper, cinnamon","slow cooker, microwave, oven, mixer",emily chen,30/01/2026
RCP02604,Savory Smoothie,Breakfast,Chinese,None,Hard,90,184,274,12,500,21.6,93.9,-15,2.5,2014,"pork, lettuce, pepper, oregano, cinnamon, cumin",blender,Emily Chen,25/11/2023
RCP02605,Sweet Smoothie,Snack,Mexican,None,Medium,82,220,302,9,144,56.9,41.6,96.9,2.2,781,"fish, broccoli, tomatoes, bell peppers, zucchini, bread, cinnamon","slow cooker, grill, oven, air fryer",,
RCP02606,Savory Pizza,Dessert,Greek,None,Medium,,,,10,1095,9.2,59.6,74.1,-1.9,672,"onions, potatoes, milk, basil, salt","microwave, food processor, air fryer",Sarah Wilson,11/20/2025
RCP02607,Savory Grilled,Salad,Mexican,Gluten-Free,Hard,27,178,205,3,566,59.7,118,85.6,3.7,2362,"garlic, mushrooms, carrots, broccoli, pasta, thyme, basil","oven, grill",mary smith,26/04/2025
RCP02608,Savory Roast,Breakfast,Mediterranean,None,Expert,85,172,257,1,759,30.3,76.1,69.2,1.3,2348,"lettuce, zucchini, quinoa, milk, salt, oregano, thyme, basil",,chef john,05/01/2024
RCP02609,Roast,Dessert,Spanish,None,Easy,53,192,245,12,885,26.2,57.8,50.6,1.6,2937,"pork, broccoli, bell peppers",grill,Bob Johnson,06/08/2025
RCP02610,Noodles,Snack,Korean,None,Easy,67,95,162,6,,45.4,67.5,66.8,1.5,34,"eggs, spinach, quinoa, cream, pepper",oven,CHEF JOHN,08/12/2024
RCP02611,Creamy Soup,Beverage,Italian,Vegetarian,Expert,45,233,278,10,244,30.6,60.9,77.9,9.6,3227,"beef, cauliflower, tomatoes, zucchini, rice","microwave, blender, food processor, slow cooker",Sarah Wilson,06/06/2025
RCP02612,Casserole,Dinner,Mexican,Paleo,Medium,58,165,223,,,26.1,147.5,37.4,4,840,"TURKEY, POTATOES, LETTUCE, BROCCOLI, ONIONS, MILK, CINNAMON, BASIL, THYME","grill, microwave, mixer",chef john,03/10/2023
RCP02613,Sweet Steamed,Snack,Spanish,Low-Carb,Expert,58,231,289,6,886,59.9,89.4,84.7,3.4,139,"turkey, onions, tomatoes, zucchini, cauliflower","grill, pressure cooker",mary smith,30/12/2024
RCP02614,Herb Soup,Appetizer,American,None,Easy,48,187,235,4,488,67,88.6,34.2,4.8,3033,"beef, mushrooms, onions, cauliflower, pasta, thyme","grill, pressure cooker",Emily Chen,18/03/2025
RCP02615,Sandwich,Dessert,Korean,None,Expert,21,151,172,1,1022,22.6,104.4,53.2,4.8,1345,"FISH, LETTUCE, BELL PEPPERS, FLOUR, BASIL, CINNAMON, THYME","mixer, grill, pressure cooker, food processor",David Lee,22/05/2025
RCP02616,Crispy Pasta,Lunch,Chinese,None,Expert,80,148,228,6,999,49.6,125.7,53.7,4.5,439,"GARLIC, LETTUCE, BREAD, CHEESE, OREGANO, BASIL","pressure cooker, grill",,2023.04.06
RCP02617,Sandwich,Dinner,French,None,Expert,23,164,187,11,230,36.9,116.5,72.1,2.4,112,"lettuce, cream, thyme, cumin, salt",microwave|grill|blender,CHEF JOHN,06/12/2024
RCP02618,Creamy Rice Bowl,Appetizer,Italian,None,Medium,99,116,215,2,658,68.1,60,54.4,2,4054,"pork, cauliflower, lettuce, yogurt, pepper, paprika",food processor,mary smith,22/06/2023
RCP02619,Savory Noodles,Snack,Chinese,Keto,Easy,,,,5,403,38,-10.6,62.5,,4025,"lettuce, mushrooms, cauliflower, zucchini, milk, salt, paprika, cinnamon","microwave, air fryer, mixer",Chef John,10/03/2023
RCP02620,Fried,Dessert,Greek,None,Hard,31,182,213,4,1010,42.7,17.1,36.3,2.1,320,"spinach, butter, cumin, cinnamon",air fryer|mixer,Chef John,01/11/2025
RCP02621,Steamed,Breakfast,Chinese,Low-Carb,Easy,44,218,262,5,90,55.7,,21.2,4.4,1478,"turkey, tomatoes, zucchini, mushrooms, lettuce, salt, cinnamon, oregano",stovetop,Chef John,05/06/2024
RCP02622,Creamy Fried,Breakfast,Mexican,None,Easy,15,203,218,-1,152,79.7,127.5,24.3,4,621,"onions, garlic, pepper, cumin, basil, cinnamon",pressure cooker,chef john,12/08/2025
RCP02623,Sweet Tacos,Dinner,Vietnamese,Gluten-Free,Easy,92,134,226,6,881,1.4,39.9,40.6,9.6,3268,lamb; bell peppers; spinach; tomatoes; lettuce; noodles; thyme; oregano,microwave,Sarah Wilson,15/08/2024
RCP02624,Herb Soup,Dessert,Italian,None,Hard,43,52,95,3,367,11.3,50.1,18.4,4.4,1324,"pork, potatoes, cumin, thyme, basil",blender,Chef John,03/04/2024
RCP02625,Sandwich,Snack,Vietnamese,Low-Carb,Expert,44,156,200,12,100,68.7,,26.5,1.6,693,"shrimp, tomatoes, cauliflower","microwave, stovetop, oven, mixer",chef john,11/04/2023
