recipe_id,recipe_name,category,cuisine,dietary_restrictions,difficulty,prep_time_mins,cook_time_mins,total_time_mins,servings,calories,protein_g,carbs_g,fat_g,rating,num_reviews,ingredients,equipment_needed,author,date_added
RCP01248,Tangy Curry,Salad,Chinese,None,Easy,112,182,294,7,925,78.2,121.7,39.8,1.1,635,"lettuce, noodles, pepper, cumin, basil",oven,David Lee,16/03/2025
RCP01249,Creamy Soup,Salad,Thai,None,Easy,67,128,195,8,1198,8.7,42.9,88.1,1.3,2317,broccoli; zucchini; pasta; salt; thyme,"microwave, food processor, blender",mary smith,25/01/2025
RCP01250,Creamy Tacos,Snack,Greek,None,Easy,97,105,202,12,482,14.8,33.6,95.9,3.1,1254,"beef, carrots, cumin",slow cooker,Bob Johnson,27/08/2023
RCP01251,Crispy Cake,Dessert,Mexican,None,Medium,26,169,195,4,290,76.5,109.5,47.9,4.3,3292,"garlic, cauliflower, mushrooms, pasta, oregano, basil, paprika, cinnamon","blender, microwave, oven, food processor",David Lee,08/05/2023
RCP01252,Creamy Stir-fry,Beverage,Mexican,Vegan,Easy,43,15,58,9,1024,68,12,42.3,3.9,-48,"BEEF, MUSHROOMS, OATS, CREAM, CINNAMON, THYME, BASIL","pressure cooker, air fryer, blender",David Lee,29/10/2023
RCP01253,Sweet Grilled,Dinner,American,None,Hard,42,228,270,9,402,13.8,69.9,18.3,2.7,1944,"lamb, zucchini, bread, cream","blender, microwave",Emily Chen,2023.04.30
RCP01254,Savory Cake,Appetizer,Korean,Low-Carb,Easy,106,63,169,3,1087,9.1,17.5,37.5,3.8,4108,"turkey, carrots, garlic, cheese, paprika","mixer, microwave",Chef John,14/06/2023
RCP01255,Sweet Smoothie,Appetizer,Korean,None,Medium,12,125,137,7,698,61.2,-16.5,55.6,3.4,2546,,microwave|slow cooker|pressure cooker|mixer,Sarah Wilson,26/07/2024
RCP01256,Spicy Grilled,Breakfast,Greek,None,Hard,65,70,135,9,794,58.8,,65.5,1.7,,"lamb, garlic, onions, potatoes, butter, oregano, thyme, paprika","stovetop, slow cooker, pressure cooker, oven",emily chen,07/06/2023
RCP01257,Spicy Rice Bowl,Appetizer,Indian,None,Expert,53,68,121,9,178,27.6,88.4,47.4,1.9,3121,"tomatoes, broccoli, mushrooms, rice, paprika",,emily chen,
RCP01258,Herb Sandwich,Appetizer,Vietnamese,None,Hard,106,96,202,5,681,56.6,103.2,13.3,4.8,2248,garlic; carrots; potatoes; flour; milk; paprika; cumin; pepper; cinnamon,"air fryer, stovetop, food processor",Emily Chen,01/07/2023
RCP01259,Savory Salad,Snack,Japanese,None,Medium,109,32,141,9,360,34.6,,51.4,4.2,2861,lamb; spinach; broccoli; garlic; quinoa; yogurt; paprika; oregano; basil; cinnamon,stovetop|slow cooker|pressure cooker,Mary Smith,12/05/2023
RCP01260,Crispy Pie,Breakfast,Thai,None,Easy,62,161,223,2,,50.3,31.4,,1.4,678,"broccoli, tomatoes, potatoes, lettuce, bread, yogurt, oregano",,Mary Smith,10-28-24
RCP01261,Savory Soup,Breakfast,Italian,None,Medium,77,39,116,2,900,65.4,51.6,9.9,1.3,4552,fish; broccoli; mushrooms; quinoa; cinnamon; oregano; pepper; paprika,"pressure cooker, oven, slow cooker, blender",Bob Johnson,02-13-24
RCP01262,Creamy Grilled,Salad,Mediterranean,None,Expert,119,65,184,5,724,9.5,79.3,84.8,1.8,2476,"carrots, onions, quinoa, butter, cumin, pepper, cinnamon, thyme","mixer, stovetop, oven, pressure cooker",emily chen,
RCP01263,Herb Soup,Snack,Italian,None,Easy,89,112,201,9,,46.1,-17.2,6.4,3,4198,"POTATOES, OREGANO, BASIL, SALT, CUMIN",grill,Emily Chen,08/01/2024
RCP01264,Crispy Stir-fry,Dessert,Mexican,Dairy-Free,Medium,25,63,88,7,392,71.4,136.2,19.9,4.3,1912,"pork, tomatoes, carrots, bell peppers, noodles, cumin, basil","slow cooker, microwave, air fryer, mixer",Emily Chen,12/01/2026
RCP01265,Savory Baked,Dinner,Korean,Gluten-Free,Medium,42,76,118,1,,,76.1,27.2,9.7,1949,"shrimp, tomatoes, cauliflower, thyme, paprika","stovetop, mixer, slow cooker",Emily Chen,22/06/2024
RCP01266,Crispy Bread,Dessert,Italian,Gluten-Free,Medium,21,147,168,6,401,79.3,,,3.2,4755,"turkey, cauliflower, tomatoes, carrots, bell peppers, thyme, cumin, cinnamon","slow cooker, grill, blender, air fryer",CHEF JOHN,29/10/2023
RCP01267,Herb Baked,Dessert,French,None,Medium,45,42,87,1,1170,36.8,,23.5,5,,"lamb, zucchini, tomatoes, potatoes, rice, cumin, thyme",grill,Emily Chen,17/10/2025
RCP01268,Tangy Pizza,Breakfast,Korean,None,Hard,27,47,74,7,636,66,31.2,64.8,3.1,494,,food processor|slow cooker|grill|stovetop,mary smith,26/11/2024
RCP01269,Crispy Curry,Lunch,Indian,None,Easy,38,12,50,2,1028,61.1,12.5,51.2,3.1,3659,"onions, cauliflower, bread, cream, thyme, salt","mixer, air fryer",Chef John,24/05/2024
RCP01270,Tangy Rice Bowl,Dessert,Korean,None,Easy,46,218,264,-2,54,64.3,58.4,74.3,3.3,3396,"carrots, pasta, paprika, cumin",,Bob Johnson,17/08/2024
RCP01271,Sweet Sandwich,Lunch,Chinese,None,Medium,53,57,110,10,1150,36.7,0.6,3.1,3.9,4821,"chicken, bell peppers, basil, oregano",grill,CHEF JOHN,23/09/2025
RCP01272,Sweet Stir-fry,Dinner,Greek,Paleo,Easy,96,196,292,1,887,52.2,25.6,20.1,2.8,1515,"zucchini, tomatoes, onions, garlic, yogurt, salt, cinnamon",pressure cooker|grill,David Lee,19/02/2025
RCP01273,Creamy Fried,Dinner,Japanese,None,Easy,25,165,190,4,926,3.8,8.9,-5.5,,1874,"mushrooms, flour, pepper, cinnamon, paprika",,mary smith,17/12/2023
RCP01274,Herb Casserole,Snack,Thai,None,Expert,36,13,49,3,549,44,113.1,90.9,3,-9,"pork, tomatoes, zucchini, broccoli, oregano, cinnamon","oven, microwave, stovetop, slow cooker",CHEF JOHN,19/04/2025
RCP01275,Pizza,Beverage,Italian,None,Medium,57,214,271,7,810,40.7,92.1,-5.8,3.3,921,"eggs, mushrooms, flour, yogurt, paprika, thyme, cinnamon","microwave, blender",Bob Johnson,21/08/2024
RCP01276,Savory Stir-fry,Appetizer,Italian,None,Hard,84,15,99,8,1163,77.5,103.5,39.8,,2533,eggs; garlic; rice; paprika; cinnamon,"mixer, stovetop, air fryer",Chef John,24/10/2024
RCP01277,Sweet Soup,Dinner,Indian,None,Expert,44,41,85,3,597,58.7,45.8,97.6,6.4,284,"tomatoes, milk, basil, salt, oregano","mixer, pressure cooker, blender",CHEF JOHN,21/07/2024
RCP01278,Crispy Sandwich,Dinner,Italian,None,Easy,22,119,141,7,298,35.4,15.6,38.3,2.9,2844,"beef, bell peppers, bread, milk, paprika, thyme","slow cooker, microwave, air fryer",emily chen,17/08/2025
RCP01279,Savory Salad,Lunch,Vietnamese,None,Hard,65,28,93,10,1184,76,61,32.4,3.3,1738,"turkey, lettuce, tomatoes, noodles, oregano, salt, basil",oven,Emily Chen,
RCP01280,Sandwich,Lunch,Chinese,Gluten-Free,Expert,116,142,258,10,175,22.6,59.2,84.6,3.8,788,,,emily chen,30/09/2023
RCP01281,Tangy Roast,Dessert,Italian,Low-Carb,Medium,101,179,280,3,656,15.1,145.6,-2,4,4026,"broccoli, spinach, zucchini, bell peppers, oats, oregano, pepper, salt, paprika","food processor, mixer",CHEF JOHN,10/07/2023
RCP01282,Crispy Pizza,Breakfast,French,Keto,Easy,49,129,178,2,360,5.6,145.8,6.7,-0.7,4476,"TOFU, BELL PEPPERS, SPINACH, ZUCCHINI, BROCCOLI, BASIL, CUMIN, CINNAMON, PAPRIKA",microwave|stovetop|slow cooker|grill,Emily Chen,14/10/2024
RCP01283,Sweet Sandwich,Dessert,Chinese,None,Hard,91,57,148,6,304,76.8,-2.5,44.8,1.1,459,"tofu, broccoli, tomatoes, salt, paprika, basil",,Sarah Wilson,04/02/2023
RCP01284,Tangy Curry,Dinner,Greek,Keto,Hard,85,222,307,8,1095,57.5,,77.5,1.4,1613,"pork, bell peppers, mushrooms, cream, pepper, oregano","grill, stovetop",David Lee,02/05/2023
RCP01285,Sweet Noodles,Snack,American,None,Expert,47,110,157,2,169,31.6,29.6,8.3,1.2,4866,"turkey, broccoli, cheese, oregano, pepper, cumin","microwave, stovetop, oven, mixer",Sarah Wilson,09/07/2025
RCP01286,Curry,Salad,Mediterranean,None,Hard,91,167,258,11,928,33.8,49.8,41.2,3.1,4303,eggs; lettuce; cream; thyme; salt; cinnamon; cumin,,emily chen,2023.06.25
RCP01287,Pie,Snack,Greek,None,Hard,10,174,184,3,547,35.4,19.3,45.8,3.7,-25,"chicken, broccoli, garlic, thyme, paprika, pepper, salt",stovetop,Sarah Wilson,06/12/2023
RCP01288,Tangy Curry,Beverage,Korean,None,Easy,20,24,44,11,1024,62.1,140.8,66.6,2.4,2958,"CARROTS, MUSHROOMS, CAULIFLOWER, OATS, MILK, THYME, BASIL, OREGANO, PEPPER","grill, blender",Bob Johnson,14/01/2025
RCP01289,Creamy Soup,Dinner,Mexican,None,Medium,17,76,93,8,,71,41.4,18.3,2,4827,"tomatoes, rice, oregano","oven, slow cooker",Emily Chen,01/07/2023
RCP01290,Creamy Fried,Appetizer,Vietnamese,None,Hard,105,161,266,11,,38.8,34,-12.4,2.5,4551,"beef, potatoes, cauliflower","oven, slow cooker, air fryer, mixer",Mary Smith,20/06/2023
RCP01291,Grilled,Appetizer,French,Vegetarian,Medium,117,15,132,10,,40.5,12.6,98.9,1.6,869,"lamb, lettuce, thyme, paprika",mixer,Chef John,24/10/2024
RCP01292,Herb Noodles,Breakfast,Japanese,None,Medium,67,195,262,,404,30.3,,69.3,3.6,3268,"tomatoes, onions, spinach, garlic, cream, basil, cumin","mixer, pressure cooker, stovetop",Chef John,27/08/2023
RCP01293,Herb Noodles,Dessert,Chinese,None,Medium,88,100,188,8,254,26.7,110.7,6.4,3.1,2783,"spinach, bell peppers, carrots, zucchini, quinoa, cinnamon, basil",slow cooker,chef john,07/10/2023
RCP01294,Crispy Curry,Dessert,Japanese,None,Easy,,,,4,-120,28.4,43.9,18,2.3,154,"fish, zucchini, onions, potatoes, bell peppers, yogurt, cumin, thyme, paprika",mixer|microwave|pressure cooker,David Lee,28/04/2023
RCP01295,Crispy Soup,Salad,Chinese,None,Easy,103,190,293,7,679,13.5,89.4,39.5,4.7,3297,"onions, cauliflower, spinach, rice, pepper, paprika, thyme","mixer, stovetop, blender, grill",emily chen,05/02/2025
RCP01296,Savory Rice Bowl,Lunch,American,Vegetarian,Hard,112,70,182,6,10422,8.7,54.6,42.6,2.1,4122,,"air fryer, mixer",Mary Smith,10/07/2023
RCP01297,Spicy Curry,Snack,American,None,Hard,-6,-33,-39,,,57.6,71,82.2,3.1,2265,"SHRIMP, ZUCCHINI, BROCCOLI, QUINOA, YOGURT, SALT, PEPPER, BASIL",food processor,Emily Chen,04/08/2025
RCP01298,Spicy Grilled,Salad,Japanese,None,Expert,,,,5,-192,14.8,90.5,55.8,4.8,3427,"POTATOES, MUSHROOMS, GARLIC, SPINACH, OATS, THYME, PEPPER, PAPRIKA","microwave, air fryer",mary smith,05/08/2024
RCP01299,Tangy Stir-fry,Dinner,Italian,None,Expert,48,155,203,2,464,70.8,48.8,65.5,2.4,2546,"mushrooms, potatoes, onions, noodles, paprika, cinnamon, basil, salt","mixer, oven, stovetop",chef john,15/02/2025
RCP01300,Baked,Breakfast,Italian,Vegetarian,Easy,47,159,206,3,295,48.8,123.4,69.3,2.4,234,"carrots, mushrooms, tomatoes, cream, basil, cinnamon, thyme","blender, food processor",CHEF JOHN,06/01/2026
RCP01301,Savory Pasta,Salad,Thai,Paleo,Easy,76,171,247,10,845,,54.2,15.6,3.4,3976,"cauliflower, rice, basil, paprika, cumin, pepper","slow cooker, pressure cooker, stovetop, oven",David Lee,30/03/2025
RCP01302,Savory Salad,Lunch,American,None,Medium,85,138,223,5,558,51.2,79.2,88.4,3.8,4813,"eggs, lettuce, bread, butter, oregano, paprika",,,08/10/2025
RCP01303,Crispy Baked,Salad,French,None,Expert,40,169,209,8,540,51.6,75.6,10.1,3.7,2480,"turkey, onions, yogurt, cinnamon, thyme, pepper, salt","air fryer, blender, grill",Emily Chen,
RCP01304,Savory Pie,Dinner,Chinese,Gluten-Free,Hard,25,234,259,9,311,77.2,8.3,-14.4,2.1,2372,"tofu, tomatoes, carrots, mushrooms, yogurt, thyme, cinnamon",microwave,mary smith,05/03/2025
RCP01305,Cake,Breakfast,Italian,Dairy-Free,Expert,77,210,287,4,623,0.2,80.1,92.9,1.4,3826,pork; mushrooms; quinoa; butter; cumin; basil; pepper; thyme,"stovetop, air fryer, microwave",Chef John,12/04/2023
RCP01306,Tangy Pizza,Salad,American,None,Hard,96,93,189,6,311,45.7,125.4,68.7,3.7,515,"carrots, broccoli, garlic, flour, milk, salt, basil, pepper, thyme","grill, mixer, microwave, oven",Emily Chen,2024.06.17
RCP01307,Cookies,Beverage,Mexican,Low-Carb,Expert,71,239,310,12,549,49.5,12.1,16.5,3.2,2901,"EGGS, ONIONS, POTATOES, SPINACH, NOODLES, PAPRIKA","slow cooker, blender, food processor, oven",CHEF JOHN,17/01/2026
RCP01308,Creamy Salad,Appetizer,Japanese,None,Expert,107,26,133,,748,70.5,42.9,39.8,4.4,1837,"BEEF, CAULIFLOWER, ONIONS, TOMATOES, BREAD, YOGURT, PEPPER, PAPRIKA, BASIL","mixer, oven",chef john,11/01/2025
RCP01309,Creamy Pie,Breakfast,Spanish,None,Easy,90,168,258,8,832,21.6,80.1,83.8,4.2,2803,"GARLIC, SPINACH, CAULIFLOWER, POTATOES, PAPRIKA, THYME, CINNAMON",,CHEF JOHN,14/05/2024
RCP01310,Sweet Steamed,Beverage,French,None,Expert,51,45,96,11,452,-7.3,32.4,57,4.8,3531,"TOFU, CAULIFLOWER, ONIONS, BELL PEPPERS, LETTUCE, OREGANO, CUMIN",slow cooker,David Lee,24/10/2024
RCP01311,Creamy Baked,Appetizer,Vietnamese,None,Hard,107,133,240,3,,23.2,58.1,-7.6,3.4,4291,"broccoli, tomatoes, milk, salt, cinnamon","food processor, slow cooker, microwave",CHEF JOHN,01/03/2023
RCP01312,Tangy Cake,Salad,Mexican,None,Expert,47,71,118,8,501,52.4,11.1,54.8,2.1,1358,"fish, potatoes, bread, butter, thyme, oregano",grill,Mary Smith,17/07/2023
RCP01313,Crispy Pasta,Lunch,French,None,Medium,5,146,151,2,1080,23.6,9.5,55.7,1.3,-18,"mushrooms, potatoes, tomatoes, oats, thyme, paprika, salt, oregano",slow cooker,Emily Chen,09-26-24
RCP01314,Herb Pie,Beverage,Japanese,Vegetarian,Easy,25,149,174,11,824,52.6,14.3,2.8,3.7,81,"lamb, broccoli, onions, paprika, cumin, cinnamon, basil","microwave, slow cooker",emily chen,23/09/2025
RCP01315,Spicy Cake,Appetizer,Mediterranean,None,Easy,64,225,289,10,11672,,88.3,64.5,5,2177,onions; basil; salt,"food processor, air fryer",CHEF JOHN,10/08/2024
RCP01316,Grilled,Snack,Greek,None,Hard,-23,-38,-61,,259,3,104.1,78.3,2.6,,"carrots, garlic, potatoes, onions, basil, cinnamon",stovetop|grill|slow cooker|mixer,Mary Smith,10/09/2024
RCP01317,Spicy Tacos,Beverage,Mexican,None,Expert,87,30,117,2,460,64.8,97.6,51.3,4.7,1348,"turkey, mushrooms, cream, thyme, cinnamon, cumin",slow cooker|mixer,David Lee,14/06/2025
RCP01318,Spicy Rice Bowl,Salad,Spanish,None,Easy,72,152,224,7,,2.7,61.7,14,2.2,937,"mushrooms, tomatoes, cinnamon, pepper, paprika, thyme","stovetop, microwave",Mary Smith,11/02/2024
RCP01319,Herb Curry,Dinner,Chinese,Low-Carb,Hard,39,214,253,9,101,65.7,145.5,91.2,4.5,4971,"lettuce, cauliflower, garlic, mushrooms, cinnamon, pepper, basil, cumin","air fryer, oven",chef john,03/05/2023
RCP01320,Tangy Cookies,Beverage,American,Vegetarian,Expert,34,40,74,4,970,59.4,132.4,91.4,4.9,3696,"eggs, carrots, tomatoes, pepper, oregano, basil, paprika","oven, mixer, microwave",mary smith,12/08/2024
RCP01321,Savory Sandwich,Breakfast,Greek,None,Expert,75,207,282,11,135,,65.1,79.5,,1126,"pork, lettuce, tomatoes, spinach, mushrooms, pasta, salt, thyme, basil, pepper",pressure cooker,,
RCP01322,Crispy Bread,Dinner,Mexican,None,Easy,72,133,205,5,921,73.8,33.3,95.1,4.5,2304,"tofu, garlic, tomatoes, flour","oven, blender, slow cooker",CHEF JOHN,27/08/2024
RCP01323,Sweet Roast,Dinner,Chinese,None,Easy,,,,2,174,76.7,52.3,37.1,2.8,90,"eggs, broccoli, onions, spinach, potatoes",air fryer,Mary Smith,15/03/2023
RCP01324,Tangy Fried,Salad,Chinese,None,Expert,71,203,274,9,856,45.2,45.8,33.5,1.5,1631,"shrimp, potatoes, garlic, pasta, thyme, cinnamon","oven, slow cooker, pressure cooker",Chef John,21/04/2025
RCP01325,Herb Bread,Dinner,Mediterranean,None,Hard,87,151,238,9,705,70.5,,32.7,3.3,1365,"onions, carrots, bread, oregano, basil","microwave, stovetop",chef john,28/08/2025
RCP01326,Savory Tacos,Lunch,American,None,Medium,70,178,248,2,589,12.8,140.7,84.9,2.7,3969,"tomatoes, zucchini, spinach, rice, yogurt, paprika, salt","stovetop, air fryer",Chef John,23/07/2025
RCP01327,Sweet Bread,Dinner,Spanish,None,Easy,60,12,72,12,769,25.9,121.7,26.6,2.7,4686,"cauliflower, quinoa, basil, pepper",,CHEF JOHN,24/08/2024
RCP01328,Spicy Stir-fry,Breakfast,American,None,Medium,30,90,120,,1099,32.6,41.1,11.2,1.9,1622,"TOMATOES, BELL PEPPERS, GARLIC, CAULIFLOWER, OREGANO, PEPPER, PAPRIKA, SALT","pressure cooker, grill, stovetop",CHEF JOHN,11/23/2024
RCP01329,Spicy Salad,Appetizer,Korean,None,Easy,91,81,172,4,1053,,143.9,0.2,3.4,1529,"shrimp, cauliflower, onions, broccoli, zucchini, rice","food processor, stovetop, grill, microwave",Bob Johnson,12/11/2025
RCP01330,Savory Pizza,Dessert,American,None,Hard,-22,-30,-52,3,-180,51.5,38.3,41.1,2.1,908,"garlic, carrots, lettuce, bell peppers","oven, grill, blender",,22/01/2026
RCP01331,Sweet Rice Bowl,Dessert,Italian,None,Hard,88,186,274,8,347,11.8,13.3,82.5,4.3,,"broccoli, garlic, tomatoes, rice, thyme",oven,mary smith,09/04/2025
RCP01332,Spicy Casserole,Snack,Korean,Keto,Medium,93,219,312,2,704,78.3,70.5,63.7,3.3,2433,"cauliflower, tomatoes, spinach, bread, milk, cinnamon, cumin",grill|air fryer|slow cooker|stovetop,Sarah Wilson,01/23/2024
RCP01333,Spicy Salad,Breakfast,Korean,Dairy-Free,Easy,90,159,249,2,854,0,115.2,62.5,3.3,345,"beef, lettuce, carrots, broccoli","slow cooker, air fryer, oven, food processor",Emily Chen,24/12/2025
RCP01334,Savory Soup,Appetizer,Korean,None,Expert,16,73,89,8,,45.3,58.7,66.7,3.4,3884,"pork, lettuce, broccoli, tomatoes, butter, paprika, salt, cumin","air fryer, blender, oven",Emily Chen,24/09/2024
RCP01335,Spicy Roast,Dinner,Korean,None,Easy,76,173,249,3,-62,42.3,32.1,76.7,3.3,2630,"shrimp, mushrooms, pasta, cheese, oregano, salt, cumin","oven, stovetop, microwave",Sarah Wilson,30/09/2025
RCP01336,Savory Cake,Beverage,Thai,None,Hard,26,232,258,12,442,48.7,115,18.7,2.9,4275,"bell peppers, carrots, broccoli, quinoa, butter, thyme, cinnamon, pepper",blender,CHEF JOHN,24/05/2025
RCP01337,Spicy Pizza,Salad,American,None,Easy,49,108,157,2,87,42.2,64.3,77.4,3.3,-35,"lamb, zucchini, potatoes, cauliflower, onions, paprika",oven|air fryer,Sarah Wilson,02/02/2024
RCP01338,Bread,Salad,Italian,Vegan,Medium,13,114,127,9,955,1.1,122.8,54.6,2.9,636,,"food processor, oven",,30/07/2025
RCP01339,Sweet Stir-fry,Appetizer,French,None,Medium,58,159,217,4,,37.6,92.7,80.7,3.4,3930,turkey; carrots; garlic,"blender, slow cooker, stovetop",,16/11/2024
RCP01340,Smoothie,Dessert,Vietnamese,Low-Carb,Medium,24,73,97,11,773,17.9,30,2.1,1.4,,"turkey, spinach, potatoes, quinoa, thyme, salt","pressure cooker, microwave",emily chen,21/09/2024
RCP01341,Crispy Grilled,Dinner,Mediterranean,None,Easy,26,179,205,4,561,62.6,77.1,62.7,7.2,2813,shrimp; spinach; mushrooms; cumin; salt; cinnamon; basil,"stovetop, food processor",David Lee,17/06/2023
RCP01342,Creamy Stir-fry,Beverage,Korean,None,Easy,102,185,287,1,179,36.9,42.8,22.7,2.4,4023,"lamb, lettuce, bread, pepper, cinnamon, cumin, paprika",air fryer,mary smith,13/06/2023
RCP01343,Creamy Pizza,Breakfast,Vietnamese,Vegetarian,Hard,20,38,58,,894,,,91.4,4.3,2417,"tofu, mushrooms, spinach, broccoli, milk, basil, thyme, oregano",slow cooker|stovetop|mixer,CHEF JOHN,
RCP01344,Crispy Rice Bowl,Dinner,Korean,None,Medium,25,103,128,4,698,,91.3,59.5,4,64,zucchini; bell peppers; oats; basil; oregano; salt; cumin,"grill, oven, stovetop",Mary Smith,14/05/2025
RCP01345,Spicy Pie,Lunch,Vietnamese,Gluten-Free,Expert,57,141,198,7,614,6.5,,65.8,2,706,"eggs, cauliflower, tomatoes, broccoli, carrots, flour, butter, thyme, cinnamon",oven,Sarah Wilson,
RCP01346,Creamy Casserole,Appetizer,Mexican,None,Expert,44,80,124,7,338,73.2,96.3,94.9,2.2,3975,"fish, zucchini, cream, salt, thyme, cinnamon","slow cooker, blender, stovetop",Chef John,12/03/2025
RCP01347,Spicy Tacos,Dessert,Greek,None,Easy,50,209,259,9,6636,,,86,3.3,3790,shrimp; lettuce; paprika,mixer|pressure cooker|stovetop|food processor,Sarah Wilson,
RCP01348,Salad,Salad,Indian,None,Medium,117,174,291,2,644,10.1,105.6,94.2,4.2,4099,"onions, lettuce, bell peppers, pepper, salt, cumin, cinnamon","food processor, slow cooker, air fryer, blender",Sarah Wilson,22/04/2024
RCP01349,Spicy Bread,Breakfast,Thai,None,Easy,102,72,174,11,1035,5.8,129.4,,,23,"turkey, cauliflower, tomatoes, zucchini, bread, salt, basil, thyme","mixer, blender",CHEF JOHN,11/12/2025
RCP01350,Fried,Lunch,Indian,None,Hard,64,151,215,10,1033,35.8,72.7,73.1,3.6,394,,"food processor, grill, oven, slow cooker",Sarah Wilson,28/04/2024
RCP01351,Crispy Rice Bowl,Lunch,Spanish,Paleo,Medium,99,69,168,12,586,17.3,24.7,37.9,1.3,2833,"fish, lettuce, cauliflower, potatoes, rice, cheese, oregano, cinnamon","air fryer, blender, oven",David Lee,20/06/2023
RCP01352,Smoothie,Lunch,Mediterranean,None,Medium,5,240,245,7,1112,33.1,,20.2,2.7,223,"beef, bell peppers, broccoli, butter, basil, paprika, oregano, cumin","oven, stovetop, blender",Bob Johnson,19/03/2023
RCP01353,Savory Tacos,Beverage,Indian,None,Hard,16,21,37,4,,23.6,72.1,95.3,,299,"beef, bell peppers, cauliflower, onions, oats, cheese, cinnamon, salt","oven, food processor",David Lee,18/05/2024
RCP01354,Rice Bowl,Beverage,Mexican,Paleo,Medium,-26,-52,-78,7,106,68.2,97.5,59.6,,4514,beef; cauliflower; basil; cumin,,Chef John,22/04/2025
RCP01355,Savory Grilled,Dinner,Korean,Paleo,Easy,27,137,164,-2,362,69,83.9,99.1,1.6,,"lamb, broccoli, lettuce, bell peppers, cheese, cumin, cinnamon, thyme",pressure cooker|oven,Mary Smith,16/06/2023
RCP01356,Crispy Noodles,Dessert,Mediterranean,Keto,Medium,63,223,286,3,300,36.4,98.9,48.5,3.6,1554,"carrots, garlic, broccoli, bell peppers, flour, basil, salt","mixer, stovetop, slow cooker, food processor",Mary Smith,25/04/2025
RCP01357,Sweet Pizza,Appetizer,Greek,None,Hard,63,75,138,4,319,10,,64.2,1.7,1516,"fish, broccoli, lettuce","blender, air fryer, grill",Chef John,21/09/2024
RCP01358,Herb Sandwich,Dinner,Greek,None,Medium,107,152,259,8,1179,74.9,,81.7,4,2050,"pork, spinach, cauliflower, milk","food processor, mixer, air fryer",Sarah Wilson,13/07/2024
RCP01359,Crispy Pasta,Breakfast,Thai,None,Medium,120,70,190,2,649,55.1,41.6,93.4,4.2,2445,eggs; cauliflower; broccoli; onions; quinoa; yogurt; basil; cinnamon,"slow cooker, food processor, stovetop",David Lee,17/04/2025
RCP01360,Tangy Baked,Breakfast,Spanish,None,Easy,59,164,223,8,668,65.5,38.2,,4.1,108,"broccoli, garlic, cinnamon, oregano, cumin, paprika","air fryer, mixer",mary smith,02/01/2024
RCP01361,Spicy Pizza,Snack,Indian,None,Easy,100,230,330,11,1087,68.3,114.3,19.7,3,247,"zucchini, pepper, oregano, cumin, salt",pressure cooker|grill,chef john,06/10/2023
RCP01362,Crispy Steamed,Breakfast,French,Gluten-Free,Expert,,,,12,1080,43.3,,,2,4584,garlic; lettuce; carrots; bread; oregano; basil,,Emily Chen,13/04/2023
RCP01363,Crispy Curry,Breakfast,Mexican,None,Easy,69,115,184,11,140,41.3,19.2,37.4,1.4,1339,bell peppers; tomatoes; broccoli; potatoes; rice,"oven, grill",Bob Johnson,12/03/2023
RCP01364,Savory Salad,Snack,Spanish,None,Expert,69,179,248,3,194,14.7,110.4,96.5,1.3,3129,"bell peppers, zucchini, garlic, broccoli, flour, butter, thyme, paprika",mixer|blender|stovetop,mary smith,27/02/2024
RCP01365,Savory Cookies,Dessert,Mexican,None,Medium,27,177,204,4,662,0.5,88.9,47.6,4.6,1419,"bell peppers, potatoes, flour",microwave,David Lee,04/04/2024
RCP01366,Crispy Stir-fry,Salad,Spanish,None,Hard,85,50,135,8,7742,,56.5,-4.5,3.3,2014,chicken; zucchini; carrots; broccoli; tomatoes; quinoa; basil,,Sarah Wilson,26/05/2025
RCP01367,Sweet Pasta,Dessert,Mediterranean,None,Easy,104,221,325,11,1040,34.5,54.5,80,3.4,2820,"tofu, lettuce, basil, cumin, paprika, cinnamon","air fryer, grill",Chef John,19/01/2025
RCP01368,Sweet Curry,Appetizer,Spanish,None,Expert,83,215,298,11,107,78.6,128.2,51.4,1.9,1059,"lettuce, garlic, zucchini, mushrooms, cream, salt, cinnamon, basil","air fryer, food processor, slow cooker, oven",Mary Smith,28/12/2023
RCP01369,Crispy Pie,Dessert,Korean,None,Easy,28,49,77,10,743,,72.4,10.1,4.8,2745,"beef, tomatoes, zucchini, cauliflower, potatoes, rice, pepper, salt","food processor, stovetop",,13/10/2024
RCP01370,Spicy Steamed,Salad,Chinese,None,Easy,112,84,196,7,370,21.4,-1.3,91.2,3.3,4134,"eggs, tomatoes, garlic, pasta, oregano, thyme",,mary smith,22/11/2025
RCP01371,Herb Soup,Salad,Italian,None,Easy,36,92,128,5,808,24.8,117.2,11.4,2.5,4503,"shrimp, potatoes, zucchini, spinach, quinoa, paprika, basil, salt, thyme",oven,CHEF JOHN,14/06/2023
RCP01372,Crispy Casserole,Dessert,Chinese,None,Easy,64,91,155,6,124,73.7,41.1,-1.5,4.5,3205,"garlic, broccoli, rice, butter, pepper","grill, stovetop, air fryer, pressure cooker",CHEF JOHN,17/06/2023
RCP01373,Creamy Cake,Dinner,Greek,None,Easy,95,95,190,11,360,36.9,67.7,5.6,4.7,2284,eggs; tomatoes; mushrooms; rice; cream; paprika; basil; cinnamon,"pressure cooker, stovetop, food processor, grill",chef john,04-19-24
RCP01374,Crispy Salad,Lunch,Spanish,None,Expert,33,85,118,4,217,8.7,41.5,42.9,2.8,190,"pork, carrots, broccoli, oats, yogurt, thyme, pepper, cinnamon","air fryer, slow cooker, grill, stovetop",CHEF JOHN,12/07/2024
RCP01375,Herb Cookies,Breakfast,Korean,None,Medium,74,105,179,4,139,-9,122.7,73.2,3.7,3597,"shrimp, carrots, bell peppers","stovetop, mixer, slow cooker",Emily Chen,11/12/2023
RCP01376,Tangy Grilled,Beverage,Spanish,None,Hard,77,159,236,1,625,58.8,121.4,88.1,4.4,1342,"SHRIMP, LETTUCE, TOMATOES, CAULIFLOWER, CINNAMON, BASIL",microwave,Sarah Wilson,29/08/2023
RCP01377,Creamy Soup,Snack,Spanish,Vegan,Hard,120,59,179,12,648,64.6,121,88.2,4.4,386,"lamb, spinach, potatoes, garlic, bell peppers, quinoa, cinnamon, basil","mixer, pressure cooker, microwave, food processor",chef john,09/07/2025
RCP01378,Sweet Pie,Snack,Greek,None,Easy,105,209,314,11,738,,69.6,68.3,1.5,,"mushrooms, onions, carrots, oats, cream, thyme, paprika, oregano","grill, stovetop",Chef John,25/03/2023
RCP01379,Tangy Cake,Snack,Korean,None,Easy,107,136,243,1,245,71.7,127.6,10.5,-1.1,4284,"BROCCOLI, TOMATOES, CREAM, CUMIN, PAPRIKA, BASIL, CINNAMON",stovetop,emily chen,04/05/2024
RCP01380,Pasta,Dessert,Italian,None,Expert,80,75,155,3,129,22.3,107.2,86,3.7,15,"tofu, broccoli, mushrooms","stovetop, pressure cooker, microwave",David Lee,11/11/2023
RCP01381,Spicy Rice Bowl,Snack,Mexican,None,Hard,31,64,95,,634,69.1,129.1,,2.1,2431,cauliflower; cheese; basil; paprika; cinnamon,"pressure cooker, mixer",,22/05/2025
RCP01382,Sweet Pizza,Snack,Italian,None,Hard,68,30,98,9,295,3.7,131.9,-6.1,1.8,4460,"eggs, carrots, quinoa, cinnamon, paprika, pepper","pressure cooker, blender",Emily Chen,29/09/2025
RCP01383,Creamy Steamed,Breakfast,Chinese,None,Medium,42,59,101,2,193,1.4,118.4,14.8,3.8,3922,"beef, cauliflower, garlic, quinoa, paprika, pepper, salt, cumin","pressure cooker, slow cooker",Emily Chen,24/09/2023
RCP01384,Sweet Pasta,Lunch,Vietnamese,Vegan,Expert,83,44,127,12,854,63.5,-9.3,99.8,1.2,4912,"beef, garlic, bread, oregano, basil","air fryer, stovetop, mixer, oven",Bob Johnson,21/06/2025
RCP01385,Salad,Salad,Indian,Dairy-Free,Expert,,,,5,466,34.7,18.1,61,2.1,3331,garlic; lettuce; cinnamon; thyme; basil,"food processor, air fryer, grill, slow cooker",,
